Cluster Title,Symbol
Complex Middle East Conflicts (44 vertices),Cluster 1
Dynamic Middle East Situation (33 vertices),Cluster 2
Escalating Israeli-Palestinian Conflict (83 vertices),Cluster 3
Escalating Middle East Violence (127 vertices),Cluster 4
Escalating Violence in Gaza (57 vertices),Cluster 5
Gaza Strip Conflict Updates (43 vertices),Cluster 6
Global News Update Today (50 vertices),Cluster 7
Israel Confronts Diverse Threats (26) (30 vertices),Cluster 8
Israel Confronts Diverse Threats (32 vertices),Cluster 9
Israel Confronts Diverse Threats (5) (13 vertices),Cluster 10
Israel Confronts Escalating Threats (6) (61 vertices),Cluster 11
Israel Confronts Escalating Threats (66 vertices),Cluster 12
Israel Confronts Escalating Violence (29 vertices),Cluster 13
Israel Confronts Gaza Threats (66 vertices),Cluster 14
Israel Confronts Gaza Violence (24 vertices),Cluster 15
Israel Confronts Hamas Threats (29 vertices),Cluster 16
Israel Confronts Hamas Violence (126 vertices),Cluster 17
Israel Confronts Multiple Fronts (25) (90 vertices),Cluster 18
Israel Confronts Multiple Fronts (72 vertices),Cluster 19
Israel Confronts Multiple Threats (10) (32 vertices),Cluster 20
Israel Confronts Multiple Threats (13) (45 vertices),Cluster 21
Israel Confronts Multiple Threats (14) (58 vertices),Cluster 22
Israel Confronts Multiple Threats (15) (31 vertices),Cluster 23
Israel Confronts Multiple Threats (17) (35 vertices),Cluster 24
Israel Confronts Multiple Threats (20) (57 vertices),Cluster 25
Israel Confronts Multiple Threats (24) (25 vertices),Cluster 26
Israel Confronts Multiple Threats (27) (63 vertices),Cluster 27
Israel Confronts Multiple Threats (32 vertices),Cluster 28
Israel Confronts Multiple Threats (7) (33 vertices),Cluster 29
Israel Confronts Multiple Threats (8) (17 vertices),Cluster 30
Israel Confronts Multiple Threats (9) (82 vertices),Cluster 31
Israel Confronts Multiple Threats and Ongoing Conflict Developments (39 vertices),Cluster 32
Israel Confronts Regional Threats (18) (38 vertices),Cluster 33
Israel Confronts Regional Threats (41 vertices),Cluster 34
Israel Confronts Terror Threats (48 vertices),Cluster 35
Israel Confronts Varied Threats (37 vertices),Cluster 36
Israel Engages in Multiple Conflicts (60 vertices),Cluster 37
Israel Faces Escalating Border Conflicts (25 vertices),Cluster 38
Israel Faces Multiple Challenges (23 vertices),Cluster 39
Israel Faces Multiple Security Threats (56 vertices),Cluster 40
Israel Faces Multiple Threats (2) (22 vertices),Cluster 41
Israel Faces Multiple Threats (93 vertices),Cluster 42
Israel Local Elections Held (25 vertices),Cluster 43
Israel Strikes Gaza Targets (62 vertices),Cluster 44
Israel Strikes Hezbollah Targets (20 vertices),Cluster 45
Israel Strikes Multiple Targets (11) (132 vertices),Cluster 46
Israel Strikes Multiple Targets (139 vertices),Cluster 47
Israel's Multifaceted Security Crisis (26 vertices),Cluster 48
Israel's Multifront Security Challenges (27 vertices),Cluster 49
Israel's Ongoing Security Concerns (31 vertices),Cluster 50
Israel's Security Crisis Deepens (66 vertices),Cluster 51
Israel's Security Situation (42 vertices),Cluster 52
Israel's Security Situation Deteriorates (29 vertices),Cluster 53
Israel's Security Situation Updates (34 vertices),Cluster 54
Israel-Palestine Ceasefire Developments (49 vertices),Cluster 55
Israel-Palestine Conflict Escalates (84 vertices),Cluster 56
Israel-Palestine Conflict Widens (62 vertices),Cluster 57
Israeli Family Mourns Loss (4 vertices),Cluster 58
Israeli-Palestinian Conflict Analysis (36 vertices),Cluster 59
Israeli-Palestinian Conflict Developments (45 vertices),Cluster 60
Israeli-Palestinian Conflict Intensifies (151 vertices),Cluster 61
Israeli-Palestinian Conflict Updates (16) (87 vertices),Cluster 62
Israeli-Palestinian Conflict Updates (56 vertices),Cluster 63
Middle East Conflict and Politics (35 vertices),Cluster 64
Middle East Conflict Escalates (82 vertices),Cluster 65
Middle East Conflict Intensifies (81 vertices),Cluster 66
Middle East Conflict Updates (12) (28 vertices),Cluster 67
Middle East Conflict Updates (19) (56 vertices),Cluster 68
Middle East Conflict Updates (21) (87 vertices),Cluster 69
Middle East Conflict Updates (26 vertices),Cluster 70
Middle East Security Concerns (22) (51 vertices),Cluster 71
Middle East Security Concerns (24 vertices),Cluster 72
Middle East Security Deteriorates (61 vertices),Cluster 73
Middle East Tensions Escalate (15 vertices),Cluster 74
Middle East Tensions Persist (39 vertices),Cluster 75
Middle East Tensions Rise (40 vertices),Cluster 76
Middle East Violence Intensifies (31 vertices),Cluster 77
Multiple Conflicts Erupt Across Middle East (75 vertices),Cluster 78
Multiple Fronts of Conflict (26 vertices),Cluster 79
Multiple Middle East Conflicts (105 vertices),Cluster 80
Multiple Security Incidents Erupt (31 vertices),Cluster 81
Multiple Security Incidents Erupt Across Middle East (50 vertices),Cluster 82
News from the Middle East (27 vertices),Cluster 83
Ongoing Conflict and Impacts (29 vertices),Cluster 84
Ongoing Middle East Tensions (142 vertices),Cluster 85
Qatar Leader Visits Egypt (14 vertices),Cluster 86
Regional Security Situation Deteriorates (3) (25 vertices),Cluster 87
Regional Security Situation Deteriorates (40 vertices),Cluster 88
Rockets Fired from Lebanon (23) (56 vertices),Cluster 89
Rockets Fired from Lebanon (60 vertices),Cluster 90
Security Situation Remains Tense (32 vertices),Cluster 91
Tensions in Gaza Region (24 vertices),Cluster 92
Tensions in the Middle East (23 vertices),Cluster 93
Tensions Rise in Middle East (39 vertices),Cluster 94
Tensions Rise in Middle East (4) (15 vertices),Cluster 95
Violence and Accidents Escalate (92 vertices),Cluster 96
Violence and Tensions Escalate in Middle East Conflict (48 vertices),Cluster 97
Violence and Tensions Rise (57 vertices),Cluster 98
Violence Escalates in Israel (19 vertices),Cluster 99
סכסוך ישראל-פלסטין מתעצם (41 vertices),Cluster 100
