Cluster Title,Symbol
ASTRO-MED and JONES Results (2 vertices),Cluster 1
Bank of England Revises (13 vertices),Cluster 2
Braniff and Goldfield Results (2 vertices),Cluster 3
Business and Financial Updates (73 vertices),Cluster 4
Companies Announce Dividend Payouts (4 vertices),Cluster 5
Companies Expand Through Acquisitions (6 vertices),Cluster 6
Companies Face Legal Challenges (9 vertices),Cluster 7
Companies Plan Stock Splits (3 vertices),Cluster 8
Companies Post Varied Earnings (22 vertices),Cluster 9
Companies Report Earnings Changes (18 vertices),Cluster 10
Companies Report Earnings Updates (21 vertices),Cluster 11
Companies Report Earnings Updates (4) (23 vertices),Cluster 12
Companies Report Financial Results (2) (24 vertices),Cluster 13
Companies Report Financial Results (23 vertices),Cluster 14
Companies Report Financial Results (3) (18 vertices),Cluster 15
Companies Report Financial Updates (20 vertices),Cluster 16
Companies Report Financial Updates (5) (33 vertices),Cluster 17
Companies Report Financial Updates (6) (12 vertices),Cluster 18
Companies Report Mixed Results (13 vertices),Cluster 19
Companies Report Varied News (18 vertices),Cluster 20
Companies Report Varied Performance (12 vertices),Cluster 21
Companies Report Varied Performance (7) (22 vertices),Cluster 22
Companies Report Varied Performance (8) (6 vertices),Cluster 23
Companies Show Financial Improvement (5 vertices),Cluster 24
Corporate Mergers and Acquisitions (29 vertices),Cluster 25
Corporations Report Earnings Results (17 vertices),Cluster 26
Diversified Industries Reports Earnings (6 vertices),Cluster 27
EC Reduces Steel Capacity (3 vertices),Cluster 28
EC Reports Financial Updates (27 vertices),Cluster 29
Economic Indicators Show Mixed Results (44 vertices),Cluster 30
Financial News and Updates (89 vertices),Cluster 31
Gelco and GenCorp Earnings (2 vertices),Cluster 32
Ghana's Cocoa Purchases Increase (2 vertices),Cluster 33
Global Economic Developments Reported (38 vertices),Cluster 34
Global Economy Experiences Fluctuations (12 vertices),Cluster 35
Global Economy Experiences Shifts (20 vertices),Cluster 36
Global Economy Faces Challenges (47 vertices),Cluster 37
Global Economy Sees Shifts (36 vertices),Cluster 38
Global Grain Market Activity (28 vertices),Cluster 39
Global Inflation Rates Vary (2 vertices),Cluster 40
ICO Coffee Quota Dispute (10 vertices),Cluster 41
Inflation and Earnings Reports (17 vertices),Cluster 42
International Cocoa Agreement Updates (8 vertices),Cluster 43
Mergers and Financial Reports (13 vertices),Cluster 44
Mining and Metals Updates (24 vertices),Cluster 45
Oil Market Sees Developments (26 vertices),Cluster 46
Retail Sector Experiences Changes (24 vertices),Cluster 47
Severe Weather Impacts Agriculture (5 vertices),Cluster 48
Specific Date Format Connection (2 vertices),Cluster 49
Trade Tensions Rise Globally (41 vertices),Cluster 50
Trusts Announce Dividend Payments (2 vertices),Cluster 51
US Financial Landscape Developments (18 vertices),Cluster 52
UTL and MAKL Performance (2 vertices),Cluster 53
Zambia's Foreign Exchange Update (3 vertices),Cluster 54
