,id,title,publication_date,ids,open_access,authorships,corresponding_author_ids,corresponding_institution_ids,cited_by_count,keywords,best_oa_location,grants,updated_date,created_date,concepts,language,abstract,apc_list,apc_paid,referenced_works
26,https://openalex.org/W4293557732,COMPOSITE MATERIALS IN BRIDGE CONSTRUCTION,2022-01-01,"{'openalex': 'https://openalex.org/W4293557732', 'doi': 'https://doi.org/10.46973/9785907295612_2022_26'}","{'is_oa': False, 'oa_status': 'closed', 'oa_url': None, 'any_repository_has_fulltext': False}","[{'author_position': 'first', 'author': {'id': 'https://openalex.org/A5072923271', 'display_name': 'Vladimir Mikhailovich Bylym', 'orcid': None}, 'institutions': [{'id': 'https://openalex.org/I4210086666', 'display_name': 'Rostov State Transport University', 'ror': 'https://ror.org/002xnzp34', 'country_code': 'RU', 'type': 'education', 'lineage': ['https://openalex.org/I4210086666']}], 'countries': ['RU'], 'is_corresponding': False, 'raw_author_name': 'Vladimir Mikhailovich Bylym', 'raw_affiliation_string': 'Rostov State Transport University (RSTU)', 'raw_affiliation_strings': ['Rostov State Transport University (RSTU)']}, {'author_position': 'middle', 'author': {'id': 'https://openalex.org/A5054071393', 'display_name': 'Kantemir Muhamedovich Zeushev', 'orcid': None}, 'institutions': [{'id': 'https://openalex.org/I4210086666', 'display_name': 'Rostov State Transport University', 'ror': 'https://ror.org/002xnzp34', 'country_code': 'RU', 'type': 'education', 'lineage': ['https://openalex.org/I4210086666']}], 'countries': ['RU'], 'is_corresponding': False, 'raw_author_name': 'Kantemir Muhamedovich Zeushev', 'raw_affiliation_string': 'Rostov State Transport University (RSTU)', 'raw_affiliation_strings': ['Rostov State Transport University (RSTU)']}, {'author_position': 'last', 'author': {'id': 'https://openalex.org/A5032673595', 'display_name': 'Natalia Viktorovna Khamidullina', 'orcid': 'https://orcid.org/0000-0001-6723-1442'}, 'institutions': [{'id': 'https://openalex.org/I4210086666', 'display_name': 'Rostov State Transport University', 'ror': 'https://ror.org/002xnzp34', 'country_code': 'RU', 'type': 'education', 'lineage': ['https://openalex.org/I4210086666']}], 'countries': ['RU'], 'is_corresponding': False, 'raw_author_name': 'Natalia Viktorovna Khamidullina', 'raw_affiliation_string': 'Rostov State Transport University (RSTU)', 'raw_affiliation_strings': ['Rostov State Transport University (RSTU)']}]",[],[],0,"[{'keyword': 'materials', 'score': 0.4403}, {'keyword': 'construction', 'score': 0.3822}]",,[],2024-01-27T23:52:34.908832,2022-08-30,"[{'id': 'https://openalex.org/C100776233', 'wikidata': 'https://www.wikidata.org/wiki/Q2532492', 'display_name': 'Bridge (graph theory)', 'level': 2, 'score': 0.7062553}, {'id': 'https://openalex.org/C104779481', 'wikidata': 'https://www.wikidata.org/wiki/Q50707', 'display_name': 'Composite number', 'level': 2, 'score': 0.56062645}, {'id': 'https://openalex.org/C192562407', 'wikidata': 'https://www.wikidata.org/wiki/Q228736', 'display_name': 'Materials science', 'level': 0, 'score': 0.45000792}, {'id': 'https://openalex.org/C66938386', 'wikidata': 'https://www.wikidata.org/wiki/Q633538', 'display_name': 'Structural engineering', 'level': 1, 'score': 0.4308626}, {'id': 'https://openalex.org/C41008148', 'wikidata': 'https://www.wikidata.org/wiki/Q21198', 'display_name': 'Computer science', 'level': 0, 'score': 0.39577827}, {'id': 'https://openalex.org/C107053488', 'wikidata': 'https://www.wikidata.org/wiki/Q2674423', 'display_name': 'Construction engineering', 'level': 1, 'score': 0.3590013}, {'id': 'https://openalex.org/C159985019', 'wikidata': 'https://www.wikidata.org/wiki/Q181790', 'display_name': 'Composite material', 'level': 1, 'score': 0.31773487}, {'id': 'https://openalex.org/C127413603', 'wikidata': 'https://www.wikidata.org/wiki/Q11023', 'display_name': 'Engineering', 'level': 0, 'score': 0.3036421}, {'id': 'https://openalex.org/C71924100', 'wikidata': 'https://www.wikidata.org/wiki/Q11190', 'display_name': 'Medicine', 'level': 0, 'score': 0.0}, {'id': 'https://openalex.org/C126322002', 'wikidata': 'https://www.wikidata.org/wiki/Q11180', 'display_name': 'Internal medicine', 'level': 1, 'score': 0.0}]",en,,,,
27,https://openalex.org/W2059547039,Vibrational dynamic materials and composites,2008-11-01,"{'openalex': 'https://openalex.org/W2059547039', 'doi': 'https://doi.org/10.1016/j.jsv.2008.03.015', 'mag': '2059547039'}","{'is_oa': False, 'oa_status': 'closed', 'oa_url': None, 'any_repository_has_fulltext': False}","[{'author_position': 'first', 'author': {'id': 'https://openalex.org/A5007054453', 'display_name': 'I. I. Blekhman', 'orcid': None}, 'institutions': [{'id': 'https://openalex.org/I4210142628', 'display_name': 'Institute of Problems of Mechanical Engineering', 'ror': 'https://ror.org/047pt5178', 'country_code': 'RU', 'type': 'facility', 'lineage': ['https://openalex.org/I4210142628', 'https://openalex.org/I4210164537']}], 'countries': ['RU'], 'is_corresponding': True, 'raw_author_name': 'I.I. Blekhman', 'raw_affiliation_string': 'Institute of Problems of Mechanical Engineering of Russian Academy of Sciences, 3, Building 5, Liniya 22, V.O., Saint Petersburg 199106, Russia', 'raw_affiliation_strings': ['Institute of Problems of Mechanical Engineering of Russian Academy of Sciences, 3, Building 5, Liniya 22, V.O., Saint Petersburg 199106, Russia']}]",['https://openalex.org/A5007054453'],['https://openalex.org/I4210142628'],10,"[{'keyword': 'vibrational dynamic materials', 'score': 0.901}, {'keyword': 'composites', 'score': 0.4653}]",,[],2024-02-01T11:40:53.685464,2016-06-24,"[{'id': 'https://openalex.org/C198394728', 'wikidata': 'https://www.wikidata.org/wiki/Q3695508', 'display_name': 'Vibration', 'level': 2, 'score': 0.7164918}, {'id': 'https://openalex.org/C28719098', 'wikidata': 'https://www.wikidata.org/wiki/Q44946', 'display_name': 'Point (geometry)', 'level': 2, 'score': 0.46626955}, {'id': 'https://openalex.org/C18762648', 'wikidata': 'https://www.wikidata.org/wiki/Q42213', 'display_name': 'Work (physics)', 'level': 2, 'score': 0.44520894}, {'id': 'https://openalex.org/C192562407', 'wikidata': 'https://www.wikidata.org/wiki/Q228736', 'display_name': 'Materials science', 'level': 0, 'score': 0.4301443}, {'id': 'https://openalex.org/C204323151', 'wikidata': 'https://www.wikidata.org/wiki/Q905424', 'display_name': 'Range (aeronautics)', 'level': 2, 'score': 0.414385}, {'id': 'https://openalex.org/C78519656', 'wikidata': 'https://www.wikidata.org/wiki/Q101333', 'display_name': 'Mechanical engineering', 'level': 1, 'score': 0.38570476}, {'id': 'https://openalex.org/C66938386', 'wikidata': 'https://www.wikidata.org/wiki/Q633538', 'display_name': 'Structural engineering', 'level': 1, 'score': 0.3589414}, {'id': 'https://openalex.org/C159985019', 'wikidata': 'https://www.wikidata.org/wiki/Q181790', 'display_name': 'Composite material', 'level': 1, 'score': 0.35507336}, {'id': 'https://openalex.org/C41008148', 'wikidata': 'https://www.wikidata.org/wiki/Q21198', 'display_name': 'Computer science', 'level': 0, 'score': 0.33714408}, {'id': 'https://openalex.org/C121332964', 'wikidata': 'https://www.wikidata.org/wiki/Q413', 'display_name': 'Physics', 'level': 0, 'score': 0.24944654}, {'id': 'https://openalex.org/C127413603', 'wikidata': 'https://www.wikidata.org/wiki/Q11023', 'display_name': 'Engineering', 'level': 0, 'score': 0.24346569}, {'id': 'https://openalex.org/C24890656', 'wikidata': 'https://www.wikidata.org/wiki/Q82811', 'display_name': 'Acoustics', 'level': 1, 'score': 0.1741369}, {'id': 'https://openalex.org/C33923547', 'wikidata': 'https://www.wikidata.org/wiki/Q395', 'display_name': 'Mathematics', 'level': 0, 'score': 0.13385153}, {'id': 'https://openalex.org/C2524010', 'wikidata': 'https://www.wikidata.org/wiki/Q8087', 'display_name': 'Geometry', 'level': 1, 'score': 0.062793314}]",en,"In this paper, the concept of dynamic materials is briefly outlined and exemplified following the work of the author published during the last decade. Then, a special kind of kinetic dynamic materials is introduced, the so-called ‘vibrational dynamics’ material with vibrational composites being its special case. A parametrically produced, vibrational dynamic material definition is introduced. Among such materials can also be a range of known systems, which can be considered to be capable of changing their properties under the action of vibration. As a case in point, an unusual dynamic material is considered, in the form of a pipe conveying a pulsating fluid.",,,
28,https://openalex.org/W3040264999,Design of composite materials for clothes,2020-01-01,"{'openalex': 'https://openalex.org/W3040264999', 'doi': 'https://doi.org/10.1051/matecconf/202031503001', 'mag': '3040264999'}","{'is_oa': True, 'oa_status': 'gold', 'oa_url': 'https://www.matec-conferences.org/articles/matecconf/pdf/2020/11/matecconf_icmsste2020_03001.pdf', 'any_repository_has_fulltext': True}","[{'author_position': 'first', 'author': {'id': 'https://openalex.org/A5078272169', 'display_name': 'С. А. Кокшаров', 'orcid': None}, 'institutions': [{'id': 'https://openalex.org/I4210124914', 'display_name': 'Institute of Solution Chemistry', 'ror': 'https://ror.org/02zp2tc18', 'country_code': 'RU', 'type': 'facility', 'lineage': ['https://openalex.org/I4210124914', 'https://openalex.org/I4210145551']}], 'countries': ['RU'], 'is_corresponding': False, 'raw_author_name': 'Sergey Koksharov', 'raw_affiliation_string': 'G.A. Krestov Institute of Solution Chemistry of the Russian Academy of Sciences, 153045, Ivanovo, Akademicheskaya st, 1, Russia', 'raw_affiliation_strings': ['G.A. Krestov Institute of Solution Chemistry of the Russian Academy of Sciences, 153045, Ivanovo, Akademicheskaya st, 1, Russia']}, {'author_position': 'middle', 'author': {'id': 'https://openalex.org/A5074300571', 'display_name': 'Н. Л. Корнилова', 'orcid': 'https://orcid.org/0000-0002-7270-0757'}, 'institutions': [{'id': 'https://openalex.org/I4210158347', 'display_name': 'Ivanovo State Polytechnic University', 'ror': 'https://ror.org/058t7m662', 'country_code': 'RU', 'type': 'education', 'lineage': ['https://openalex.org/I4210158347']}], 'countries': ['RU'], 'is_corresponding': False, 'raw_author_name': 'Nadezhda Kornilova', 'raw_affiliation_string': 'Ivanovo State Polytechnic University, 153000, Ivanovo, Sheremetevsky ave., 21, Russia', 'raw_affiliation_strings': ['Ivanovo State Polytechnic University, 153000, Ivanovo, Sheremetevsky ave., 21, Russia']}, {'author_position': 'last', 'author': {'id': 'https://openalex.org/A5038012526', 'display_name': 'Yulia Shammut', 'orcid': None}, 'institutions': [{'id': 'https://openalex.org/I4210158347', 'display_name': 'Ivanovo State Polytechnic University', 'ror': 'https://ror.org/058t7m662', 'country_code': 'RU', 'type': 'education', 'lineage': ['https://openalex.org/I4210158347']}], 'countries': ['RU'], 'is_corresponding': False, 'raw_author_name': 'Yulia Shammut', 'raw_affiliation_string': 'Ivanovo State Polytechnic University, 153000, Ivanovo, Sheremetevsky ave., 21, Russia', 'raw_affiliation_strings': ['Ivanovo State Polytechnic University, 153000, Ivanovo, Sheremetevsky ave., 21, Russia']}]",[],[],0,"[{'keyword': 'composite materials', 'score': 0.692}, {'keyword': 'clothes', 'score': 0.5244}, {'keyword': 'design', 'score': 0.2974}]","{'is_oa': True, 'landing_page_url': 'https://doi.org/10.1051/matecconf/202031503001', 'pdf_url': 'https://www.matec-conferences.org/articles/matecconf/pdf/2020/11/matecconf_icmsste2020_03001.pdf', 'source': {'id': 'https://openalex.org/S4210175061', 'display_name': 'MATEC web of conferences', 'issn_l': '2261-236X', 'issn': ['2261-236X', '2274-7214'], 'is_oa': True, 'is_in_doaj': True, 'host_organization': 'https://openalex.org/P4310319748', 'host_organization_name': 'EDP Sciences', 'host_organization_lineage': ['https://openalex.org/P4310319748'], 'host_organization_lineage_names': ['EDP Sciences'], 'type': 'journal'}, 'license': 'cc-by', 'version': 'publishedVersion', 'is_accepted': True, 'is_published': True}",[],2024-02-02T11:25:16.114417,2020-07-10,"[{'id': 'https://openalex.org/C133074676', 'wikidata': 'https://www.wikidata.org/wiki/Q428729', 'display_name': 'Fusible alloy', 'level': 2, 'score': 0.8388641}, {'id': 'https://openalex.org/C104779481', 'wikidata': 'https://www.wikidata.org/wiki/Q50707', 'display_name': 'Composite number', 'level': 2, 'score': 0.7508447}, {'id': 'https://openalex.org/C207467718', 'wikidata': 'https://www.wikidata.org/wiki/Q4354973', 'display_name': 'Interlining', 'level': 2, 'score': 0.7486374}, {'id': 'https://openalex.org/C2779372316', 'wikidata': 'https://www.wikidata.org/wiki/Q569057', 'display_name': 'Stiffness', 'level': 2, 'score': 0.70149744}, {'id': 'https://openalex.org/C530175646', 'wikidata': 'https://www.wikidata.org/wiki/Q11460', 'display_name': 'Clothing', 'level': 2, 'score': 0.6570671}, {'id': 'https://openalex.org/C192562407', 'wikidata': 'https://www.wikidata.org/wiki/Q228736', 'display_name': 'Materials science', 'level': 0, 'score': 0.5093256}, {'id': 'https://openalex.org/C159985019', 'wikidata': 'https://www.wikidata.org/wiki/Q181790', 'display_name': 'Composite material', 'level': 1, 'score': 0.48611164}, {'id': 'https://openalex.org/C66938386', 'wikidata': 'https://www.wikidata.org/wiki/Q633538', 'display_name': 'Structural engineering', 'level': 1, 'score': 0.38800776}, {'id': 'https://openalex.org/C127413603', 'wikidata': 'https://www.wikidata.org/wiki/Q11023', 'display_name': 'Engineering', 'level': 0, 'score': 0.18374917}, {'id': 'https://openalex.org/C166957645', 'wikidata': 'https://www.wikidata.org/wiki/Q23498', 'display_name': 'Archaeology', 'level': 1, 'score': 0.0}, {'id': 'https://openalex.org/C95457728', 'wikidata': 'https://www.wikidata.org/wiki/Q309', 'display_name': 'History', 'level': 0, 'score': 0.0}]",en,"Transition to digital models of garments is the first step in dig-itization of the light industry. Adequate digital models can be obtained by using precise parameters of stress-strain properties of a fabric and other materials. The study has revealed regression dependences of the stiffness index of the polymer – fibre composite on the stiffness of the suit fabric and the combination of fusible interlining parameters. The obtained equa-tions can be used to design composite materials of the required stiffness, depending on the form of clothing being created",,,
29,https://openalex.org/W2924029898,Composite materials cohesion parameters,2019-03-26,"{'openalex': 'https://openalex.org/W2924029898', 'doi': 'https://doi.org/10.1088/1757-899x/489/1/012006', 'mag': '2924029898'}","{'is_oa': True, 'oa_status': 'gold', 'oa_url': 'https://iopscience.iop.org/article/10.1088/1757-899X/489/1/012006/pdf', 'any_repository_has_fulltext': True}","[{'author_position': 'first', 'author': {'id': 'https://openalex.org/A5086800374', 'display_name': 'Kristina Kotova', 'orcid': None}, 'institutions': [{'id': 'https://openalex.org/I4210106257', 'display_name': 'Voronezh State Technical University', 'ror': 'https://ror.org/01m20f643', 'country_code': 'RU', 'type': 'education', 'lineage': ['https://openalex.org/I4210106257']}], 'countries': ['RU'], 'is_corresponding': False, 'raw_author_name': 'K. S. Kotova', 'raw_affiliation_string': 'Department of Design of Buildings and Constructions named after N.V. Troitskogo, Voronezh State Technical University, Bldg 84, 20-letiya Oktyabrya St., Voronezh 394006, Russia', 'raw_affiliation_strings': ['Department of Design of Buildings and Constructions named after N.V. Troitskogo, Voronezh State Technical University, Bldg 84, 20-letiya Oktyabrya St., Voronezh 394006, Russia']}, {'author_position': 'last', 'author': {'id': 'https://openalex.org/A5073958083', 'display_name': 'G.S. Slavcheva', 'orcid': 'https://orcid.org/0000-0001-8800-2657'}, 'institutions': [{'id': 'https://openalex.org/I4210106257', 'display_name': 'Voronezh State Technical University', 'ror': 'https://ror.org/01m20f643', 'country_code': 'RU', 'type': 'education', 'lineage': ['https://openalex.org/I4210106257']}], 'countries': ['RU'], 'is_corresponding': False, 'raw_author_name': 'G. S. Slavcheva', 'raw_affiliation_string': 'Department of Building Materials Technology and Structures, Voronezh State Technical University, Bldg 84, 20-letiya Oktyabrya St., Voronezh 394006, Russia', 'raw_affiliation_strings': ['Department of Building Materials Technology and Structures, Voronezh State Technical University, Bldg 84, 20-letiya Oktyabrya St., Voronezh 394006, Russia']}]",[],[],1,"[{'keyword': 'composite materials', 'score': 0.6137}]","{'is_oa': True, 'landing_page_url': 'https://doi.org/10.1088/1757-899x/489/1/012006', 'pdf_url': 'https://iopscience.iop.org/article/10.1088/1757-899X/489/1/012006/pdf', 'source': None, 'license': None, 'version': 'publishedVersion', 'is_accepted': True, 'is_published': True}",[],2024-01-30T14:13:05.186237,2019-04-01,"[{'id': 'https://openalex.org/C67203356', 'wikidata': 'https://www.wikidata.org/wiki/Q1321905', 'display_name': 'Reinforcement', 'level': 2, 'score': 0.9359273}, {'id': 'https://openalex.org/C104779481', 'wikidata': 'https://www.wikidata.org/wiki/Q50707', 'display_name': 'Composite number', 'level': 2, 'score': 0.8317096}, {'id': 'https://openalex.org/C104054115', 'wikidata': 'https://www.wikidata.org/wiki/Q216828', 'display_name': 'Cohesion (chemistry)', 'level': 2, 'score': 0.7039839}, {'id': 'https://openalex.org/C192562407', 'wikidata': 'https://www.wikidata.org/wiki/Q228736', 'display_name': 'Materials science', 'level': 0, 'score': 0.60135466}, {'id': 'https://openalex.org/C159985019', 'wikidata': 'https://www.wikidata.org/wiki/Q181790', 'display_name': 'Composite material', 'level': 1, 'score': 0.5992639}, {'id': 'https://openalex.org/C185592680', 'wikidata': 'https://www.wikidata.org/wiki/Q2329', 'display_name': 'Chemistry', 'level': 0, 'score': 0.04499334}, {'id': 'https://openalex.org/C178790620', 'wikidata': 'https://www.wikidata.org/wiki/Q11351', 'display_name': 'Organic chemistry', 'level': 1, 'score': 0.0}]",en,"The article presents the study results of parameters of the macroporous composite cohesion with glass composite parameters, basalt composite and metal reinforcement elements by the pull-out of the bar from a concrete cube. It has been established that the best joint operation of reinforcement element with macroporous composite can be ensured by the use of glass composite reinforcement element. Ultimate strength of its cohesion with macroporous composite of B7.5 (D1400), B10 (D1600) classes is 20-45% higher than the values of cohesion strength of basalt composite and metal reinforcement elements for all options of combining the classes by strength and diameter of reinforcement elements (∅ 6,8,10 mm). With increased strength class of the composite, ultimate strength of all the studied types of reinforcement elements is growing consistently. The change in strength of reinforcement elements cohesion with macroporous composite through variation of their diameter has different patterns for the studied types of reinforcement elements.",,,
30,https://openalex.org/W2018299941,Production of metal composite materials,2006-01-01,"{'openalex': 'https://openalex.org/W2018299941', 'doi': 'https://doi.org/10.1007/s10717-006-0039-3', 'mag': '2018299941'}","{'is_oa': False, 'oa_status': 'closed', 'oa_url': None, 'any_repository_has_fulltext': False}","[{'author_position': 'first', 'author': {'id': 'https://openalex.org/A5016204755', 'display_name': 'N. V. Klyuchnikova', 'orcid': None}, 'institutions': [{'id': 'https://openalex.org/I2803070147', 'display_name': 'Belgorod State Technological University', 'ror': 'https://ror.org/02v40vz65', 'country_code': 'RU', 'type': 'education', 'lineage': ['https://openalex.org/I2803070147']}], 'countries': ['RU'], 'is_corresponding': False, 'raw_author_name': 'N. V. Klyuchnikova', 'raw_affiliation_string': 'V.G. Shukhov Belgorod State Technological University, Belgorod, Russia', 'raw_affiliation_strings': ['V.G. Shukhov Belgorod State Technological University, Belgorod, Russia']}, {'author_position': 'last', 'author': {'id': 'https://openalex.org/A5074197398', 'display_name': 'Елена Анатольевна Лымарь', 'orcid': None}, 'institutions': [{'id': 'https://openalex.org/I2803070147', 'display_name': 'Belgorod State Technological University', 'ror': 'https://ror.org/02v40vz65', 'country_code': 'RU', 'type': 'education', 'lineage': ['https://openalex.org/I2803070147']}], 'countries': ['RU'], 'is_corresponding': False, 'raw_author_name': 'E. A. Lymar', 'raw_affiliation_string': 'V.G. Shukhov Belgorod State Technological University, Belgorod, Russia', 'raw_affiliation_strings': ['V.G. Shukhov Belgorod State Technological University, Belgorod, Russia']}]",[],[],3,"[{'keyword': 'composite materials', 'score': 0.6397}, {'keyword': 'production', 'score': 0.4221}, {'keyword': 'metal', 'score': 0.4191}]",,[],2024-01-29T15:43:46.062438,2016-06-24,"[{'id': 'https://openalex.org/C192562407', 'wikidata': 'https://www.wikidata.org/wiki/Q228736', 'display_name': 'Materials science', 'level': 0, 'score': 0.7647579}, {'id': 'https://openalex.org/C159985019', 'wikidata': 'https://www.wikidata.org/wiki/Q181790', 'display_name': 'Composite material', 'level': 1, 'score': 0.6856583}, {'id': 'https://openalex.org/C2778223994', 'wikidata': 'https://www.wikidata.org/wiki/Q905592', 'display_name': 'Filler (materials)', 'level': 2, 'score': 0.65096664}, {'id': 'https://openalex.org/C104779481', 'wikidata': 'https://www.wikidata.org/wiki/Q50707', 'display_name': 'Composite number', 'level': 2, 'score': 0.6298406}, {'id': 'https://openalex.org/C134132462', 'wikidata': 'https://www.wikidata.org/wiki/Q45621', 'display_name': 'Ceramic', 'level': 2, 'score': 0.62879103}, {'id': 'https://openalex.org/C544153396', 'wikidata': 'https://www.wikidata.org/wiki/Q11426', 'display_name': 'Metal', 'level': 2, 'score': 0.62610054}, {'id': 'https://openalex.org/C206139338', 'wikidata': 'https://www.wikidata.org/wiki/Q192355', 'display_name': 'Raw material', 'level': 2, 'score': 0.5423596}, {'id': 'https://openalex.org/C106487976', 'wikidata': 'https://www.wikidata.org/wiki/Q685816', 'display_name': 'Matrix (chemical analysis)', 'level': 2, 'score': 0.45208398}, {'id': 'https://openalex.org/C2778348673', 'wikidata': 'https://www.wikidata.org/wiki/Q739302', 'display_name': 'Production (economics)', 'level': 2, 'score': 0.4402871}, {'id': 'https://openalex.org/C191897082', 'wikidata': 'https://www.wikidata.org/wiki/Q11467', 'display_name': 'Metallurgy', 'level': 1, 'score': 0.3070771}, {'id': 'https://openalex.org/C185592680', 'wikidata': 'https://www.wikidata.org/wiki/Q2329', 'display_name': 'Chemistry', 'level': 0, 'score': 0.046164066}, {'id': 'https://openalex.org/C162324750', 'wikidata': 'https://www.wikidata.org/wiki/Q8134', 'display_name': 'Economics', 'level': 0, 'score': 0.0}, {'id': 'https://openalex.org/C139719470', 'wikidata': 'https://www.wikidata.org/wiki/Q39680', 'display_name': 'Macroeconomics', 'level': 1, 'score': 0.0}, {'id': 'https://openalex.org/C178790620', 'wikidata': 'https://www.wikidata.org/wiki/Q11351', 'display_name': 'Organic chemistry', 'level': 1, 'score': 0.0}]",en,,,,
