,id,title,publication_date,ids,open_access,authorships,corresponding_author_ids,corresponding_institution_ids,cited_by_count,keywords,best_oa_location,grants,updated_date,created_date,concepts,language,abstract,apc_list,apc_paid,referenced_works
0,https://openalex.org/W3190378040,Classification of composite materials,2012-06-01,"{'openalex': 'https://openalex.org/W3190378040', 'mag': '3190378040'}","{'is_oa': False, 'oa_status': 'closed', 'oa_url': None, 'any_repository_has_fulltext': False}","[{'author_position': 'first', 'author': {'id': 'https://openalex.org/A5042865234', 'display_name': 'В. А. Рогов', 'orcid': 'https://orcid.org/0000-0002-2164-2323'}, 'institutions': [{'id': 'https://openalex.org/I126527374', 'display_name': ""Peoples' Friendship University of Russia"", 'ror': 'https://ror.org/02dn9h927', 'country_code': 'RU', 'type': 'education', 'lineage': ['https://openalex.org/I126527374']}], 'countries': ['RU'], 'is_corresponding': False, 'raw_author_name': 'V A Rogov', 'raw_affiliation_string': ""People's Friendship University of Russia"", 'raw_affiliation_strings': [""People's Friendship University of Russia""]}, {'author_position': 'middle', 'author': {'id': 'https://openalex.org/A5019479502', 'display_name': 'Рогов Владимир Александрович', 'orcid': None}, 'institutions': [], 'countries': [], 'is_corresponding': False, 'raw_author_name': 'Рогов Владимир Александрович', 'raw_affiliation_string': 'Российский университет дружбы народов', 'raw_affiliation_strings': ['Российский университет дружбы народов']}, {'author_position': 'middle', 'author': {'id': 'https://openalex.org/A5030699765', 'display_name': 'М. И. Шкарупа', 'orcid': None}, 'institutions': [], 'countries': [], 'is_corresponding': False, 'raw_author_name': 'M I Shkarupa', 'raw_affiliation_string': 'Obninsk Research and Production Enterprise Technologiya', 'raw_affiliation_strings': ['Obninsk Research and Production Enterprise Technologiya']}, {'author_position': 'middle', 'author': {'id': 'https://openalex.org/A5027351084', 'display_name': 'Шкарупа Михаил Игоревич', 'orcid': None}, 'institutions': [], 'countries': [], 'is_corresponding': False, 'raw_author_name': 'Шкарупа Михаил Игоревич', 'raw_affiliation_string': 'ОАО Обнинское научно-производственное предприятие «Технология»', 'raw_affiliation_strings': ['ОАО Обнинское научно-производственное предприятие «Технология»']}, {'author_position': 'middle', 'author': {'id': 'https://openalex.org/A5028454308', 'display_name': 'A C Veliz', 'orcid': None}, 'institutions': [{'id': 'https://openalex.org/I126527374', 'display_name': ""Peoples' Friendship University of Russia"", 'ror': 'https://ror.org/02dn9h927', 'country_code': 'RU', 'type': 'education', 'lineage': ['https://openalex.org/I126527374']}], 'countries': ['RU'], 'is_corresponding': False, 'raw_author_name': 'A C Veliz', 'raw_affiliation_string': ""People's Friendship University of Russia"", 'raw_affiliation_strings': [""People's Friendship University of Russia""]}, {'author_position': 'last', 'author': {'id': 'https://openalex.org/A5072714747', 'display_name': 'Велис Алехандро К', 'orcid': None}, 'institutions': [], 'countries': [], 'is_corresponding': False, 'raw_author_name': 'Велис Алехандро К', 'raw_affiliation_string': 'Российский университет дружбы народов', 'raw_affiliation_strings': ['Российский университет дружбы народов']}]",[],[],0,"[{'keyword': 'composite materials', 'score': 0.7167}, {'keyword': 'classification', 'score': 0.4738}]",,[],2024-01-27T19:53:56.018960,2021-08-16,"[{'id': 'https://openalex.org/C104779481', 'wikidata': 'https://www.wikidata.org/wiki/Q50707', 'display_name': 'Composite number', 'level': 2, 'score': 0.6430441}, {'id': 'https://openalex.org/C41008148', 'wikidata': 'https://www.wikidata.org/wiki/Q21198', 'display_name': 'Computer science', 'level': 0, 'score': 0.3702652}, {'id': 'https://openalex.org/C192562407', 'wikidata': 'https://www.wikidata.org/wiki/Q228736', 'display_name': 'Materials science', 'level': 0, 'score': 0.3442152}, {'id': 'https://openalex.org/C159985019', 'wikidata': 'https://www.wikidata.org/wiki/Q181790', 'display_name': 'Composite material', 'level': 1, 'score': 0.30342555}]",en,This paper is and introduction to composite materials CM. We tried to be simple in our explanation about CM and tried to give the most necessary knowledge to introduce the reader to the amazing word of composites.,,,
1,https://openalex.org/W4361990631,Ergodesign and composite materials,2023-01-01,"{'openalex': 'https://openalex.org/W4361990631', 'doi': 'https://doi.org/10.1051/e3sconf/202337601007'}","{'is_oa': True, 'oa_status': 'gold', 'oa_url': 'https://www.e3s-conferences.org/articles/e3sconf/pdf/2023/13/e3sconf_ersme2023_01007.pdf', 'any_repository_has_fulltext': True}","[{'author_position': 'first', 'author': {'id': 'https://openalex.org/A5078923383', 'display_name': 'N. Terekhova', 'orcid': None}, 'institutions': [{'id': 'https://openalex.org/I177537411', 'display_name': 'Bauman Moscow State Technical University', 'ror': 'https://ror.org/00pb8h375', 'country_code': 'RU', 'type': 'education', 'lineage': ['https://openalex.org/I177537411']}], 'countries': ['RU'], 'is_corresponding': True, 'raw_author_name': 'N. Terekhova', 'raw_affiliation_string': 'Bauman Moscow State Technical University (BMSTU), 2nd Baumanskaya Str., bldg. 1, 105005, Moscow, Russian Federation', 'raw_affiliation_strings': ['Bauman Moscow State Technical University (BMSTU), 2nd Baumanskaya Str., bldg. 1, 105005, Moscow, Russian Federation']}, {'author_position': 'middle', 'author': {'id': 'https://openalex.org/A5088357708', 'display_name': 'A. Kumashkova', 'orcid': None}, 'institutions': [{'id': 'https://openalex.org/I177537411', 'display_name': 'Bauman Moscow State Technical University', 'ror': 'https://ror.org/00pb8h375', 'country_code': 'RU', 'type': 'education', 'lineage': ['https://openalex.org/I177537411']}], 'countries': ['RU'], 'is_corresponding': False, 'raw_author_name': 'A. Kumashkova', 'raw_affiliation_string': 'Bauman Moscow State Technical University (BMSTU), 2nd Baumanskaya Str., bldg. 1, 105005, Moscow, Russian Federation', 'raw_affiliation_strings': ['Bauman Moscow State Technical University (BMSTU), 2nd Baumanskaya Str., bldg. 1, 105005, Moscow, Russian Federation']}, {'author_position': 'last', 'author': {'id': 'https://openalex.org/A5032794722', 'display_name': 'M. Dyukov', 'orcid': None}, 'institutions': [{'id': 'https://openalex.org/I177537411', 'display_name': 'Bauman Moscow State Technical University', 'ror': 'https://ror.org/00pb8h375', 'country_code': 'RU', 'type': 'education', 'lineage': ['https://openalex.org/I177537411']}], 'countries': ['RU'], 'is_corresponding': False, 'raw_author_name': 'M. Dyukov', 'raw_affiliation_string': 'Bauman Moscow State Technical University (BMSTU), 2nd Baumanskaya Str., bldg. 1, 105005, Moscow, Russian Federation', 'raw_affiliation_strings': ['Bauman Moscow State Technical University (BMSTU), 2nd Baumanskaya Str., bldg. 1, 105005, Moscow, Russian Federation']}]",['https://openalex.org/A5078923383'],['https://openalex.org/I177537411'],1,"[{'keyword': 'composite materials', 'score': 0.5753}]","{'is_oa': True, 'landing_page_url': 'https://doi.org/10.1051/e3sconf/202337601007', 'pdf_url': 'https://www.e3s-conferences.org/articles/e3sconf/pdf/2023/13/e3sconf_ersme2023_01007.pdf', 'source': {'id': 'https://openalex.org/S4210186093', 'display_name': 'E3S web of conferences', 'issn_l': '2267-1242', 'issn': ['2555-0403', '2267-1242'], 'is_oa': True, 'is_in_doaj': True, 'host_organization': 'https://openalex.org/P4310319748', 'host_organization_name': 'EDP Sciences', 'host_organization_lineage': ['https://openalex.org/P4310319748'], 'host_organization_lineage_names': ['EDP Sciences'], 'type': 'journal'}, 'license': 'cc-by', 'version': 'publishedVersion', 'is_accepted': True, 'is_published': True}",[],2024-02-02T08:46:08.376875,2023-04-05,"[{'id': 'https://openalex.org/C2779530757', 'wikidata': 'https://www.wikidata.org/wiki/Q1207505', 'display_name': 'Quality (philosophy)', 'level': 2, 'score': 0.5847089}, {'id': 'https://openalex.org/C28719098', 'wikidata': 'https://www.wikidata.org/wiki/Q44946', 'display_name': 'Point (geometry)', 'level': 2, 'score': 0.5424325}, {'id': 'https://openalex.org/C41008148', 'wikidata': 'https://www.wikidata.org/wiki/Q21198', 'display_name': 'Computer science', 'level': 0, 'score': 0.5413191}, {'id': 'https://openalex.org/C2777855551', 'wikidata': 'https://www.wikidata.org/wiki/Q12310021', 'display_name': 'Subject (documents)', 'level': 2, 'score': 0.46540955}, {'id': 'https://openalex.org/C2776542497', 'wikidata': 'https://www.wikidata.org/wiki/Q5266672', 'display_name': 'Development (topology)', 'level': 2, 'score': 0.44152415}, {'id': 'https://openalex.org/C539667460', 'wikidata': 'https://www.wikidata.org/wiki/Q2414942', 'display_name': 'Management science', 'level': 1, 'score': 0.39789546}, {'id': 'https://openalex.org/C110354214', 'wikidata': 'https://www.wikidata.org/wiki/Q6314146', 'display_name': 'Engineering management', 'level': 1, 'score': 0.38432413}, {'id': 'https://openalex.org/C201995342', 'wikidata': 'https://www.wikidata.org/wiki/Q682496', 'display_name': 'Systems engineering', 'level': 1, 'score': 0.37490714}, {'id': 'https://openalex.org/C117671659', 'wikidata': 'https://www.wikidata.org/wiki/Q11049265', 'display_name': 'Manufacturing engineering', 'level': 1, 'score': 0.33446974}, {'id': 'https://openalex.org/C127413603', 'wikidata': 'https://www.wikidata.org/wiki/Q11023', 'display_name': 'Engineering', 'level': 0, 'score': 0.3219782}, {'id': 'https://openalex.org/C136764020', 'wikidata': 'https://www.wikidata.org/wiki/Q466', 'display_name': 'World Wide Web', 'level': 1, 'score': 0.08304015}, {'id': 'https://openalex.org/C33923547', 'wikidata': 'https://www.wikidata.org/wiki/Q395', 'display_name': 'Mathematics', 'level': 0, 'score': 0.077525586}, {'id': 'https://openalex.org/C134306372', 'wikidata': 'https://www.wikidata.org/wiki/Q7754', 'display_name': 'Mathematical analysis', 'level': 1, 'score': 0.0}, {'id': 'https://openalex.org/C138885662', 'wikidata': 'https://www.wikidata.org/wiki/Q5891', 'display_name': 'Philosophy', 'level': 0, 'score': 0.0}, {'id': 'https://openalex.org/C2524010', 'wikidata': 'https://www.wikidata.org/wiki/Q8087', 'display_name': 'Geometry', 'level': 1, 'score': 0.0}, {'id': 'https://openalex.org/C111472728', 'wikidata': 'https://www.wikidata.org/wiki/Q9471', 'display_name': 'Epistemology', 'level': 1, 'score': 0.0}]",en,"This article is devoted to the study of the relationship between materials and ergodesign with various attributes. Examples of experimental research demonstrating the possibilities of using materials, along with other design and ergonomics tools, are given. The article describes the history of the development of Russian design and ergonomics as stages of the creation of the theory and methodology of ergodesign. The trends of formation and new developments in this area are considered. It is concluded that the creation of new objects of the subject world and systems cannot be carried out without integrated design activities with the introduction of the achievements of ergodesign, which is an innovative technology of integrated design. The article also responds to the problem, because of which the concept of ergodesign was adopted, namely the rapid development of technology without taking into account the needs and characteristics of a person. The urgency of the research is due to the rapid development of technologies that impose new requirements on various design products. This also applies to materials that are the basis of any material form, and from the point of view of innovative design, they must have unique properties, ensuring high-quality human activity at a new higher level.",,,
2,https://openalex.org/W3123300812,On the issue of composite materials,2020-12-16,"{'openalex': 'https://openalex.org/W3123300812', 'doi': 'https://doi.org/10.17816/1728-2802-2020-24-4-278-282', 'mag': '3123300812'}","{'is_oa': True, 'oa_status': 'gold', 'oa_url': 'https://doi.org/10.17816/1728-2802-2020-24-4-278-282', 'any_repository_has_fulltext': False}","[{'author_position': 'first', 'author': {'id': 'https://openalex.org/A5076922380', 'display_name': 'Olga Mohamed Hassan Bait Said', 'orcid': None}, 'institutions': [{'id': 'https://openalex.org/I126527374', 'display_name': ""Peoples' Friendship University of Russia"", 'ror': 'https://ror.org/02dn9h927', 'country_code': 'RU', 'type': 'education', 'lineage': ['https://openalex.org/I126527374']}], 'countries': ['RU'], 'is_corresponding': False, 'raw_author_name': 'Olga Mohamed Hassan Bait Said', 'raw_affiliation_string': ""Peoples' Friendship University of Russia"", 'raw_affiliation_strings': [""Peoples' Friendship University of Russia""]}, {'author_position': 'middle', 'author': {'id': 'https://openalex.org/A5042607037', 'display_name': 'S. V. Razumova', 'orcid': None}, 'institutions': [{'id': 'https://openalex.org/I126527374', 'display_name': ""Peoples' Friendship University of Russia"", 'ror': 'https://ror.org/02dn9h927', 'country_code': 'RU', 'type': 'education', 'lineage': ['https://openalex.org/I126527374']}], 'countries': ['RU'], 'is_corresponding': False, 'raw_author_name': 'S. V. Razumova', 'raw_affiliation_string': ""Peoples' Friendship University of Russia"", 'raw_affiliation_strings': [""Peoples' Friendship University of Russia""]}, {'author_position': 'last', 'author': {'id': 'https://openalex.org/A5014013755', 'display_name': 'Э. В. Величко', 'orcid': None}, 'institutions': [{'id': 'https://openalex.org/I126527374', 'display_name': ""Peoples' Friendship University of Russia"", 'ror': 'https://ror.org/02dn9h927', 'country_code': 'RU', 'type': 'education', 'lineage': ['https://openalex.org/I126527374']}], 'countries': ['RU'], 'is_corresponding': False, 'raw_author_name': 'E. V. Velichko', 'raw_affiliation_string': ""Peoples' Friendship University of Russia"", 'raw_affiliation_strings': [""Peoples' Friendship University of Russia""]}]",[],[],4,"[{'keyword': 'composite', 'score': 0.6267}, {'keyword': 'materials', 'score': 0.5903}]","{'is_oa': True, 'landing_page_url': 'https://doi.org/10.17816/1728-2802-2020-24-4-278-282', 'pdf_url': None, 'source': {'id': 'https://openalex.org/S4210181676', 'display_name': 'Российский стоматологический журнал', 'issn_l': '1728-2802', 'issn': ['1728-2802', '2413-2934'], 'is_oa': True, 'is_in_doaj': False, 'host_organization': None, 'host_organization_name': None, 'host_organization_lineage': [], 'host_organization_lineage_names': [], 'type': 'journal'}, 'license': None, 'version': 'publishedVersion', 'is_accepted': True, 'is_published': True}",[],2024-01-31T11:55:16.262414,2021-02-01,"[{'id': 'https://openalex.org/C2776052348', 'wikidata': 'https://www.wikidata.org/wiki/Q904488', 'display_name': 'Demineralization', 'level': 3, 'score': 0.67861927}, {'id': 'https://openalex.org/C199343813', 'wikidata': 'https://www.wikidata.org/wiki/Q12128', 'display_name': 'Dentistry', 'level': 1, 'score': 0.66459084}, {'id': 'https://openalex.org/C192562407', 'wikidata': 'https://www.wikidata.org/wiki/Q228736', 'display_name': 'Materials science', 'level': 0, 'score': 0.4044574}, {'id': 'https://openalex.org/C29694066', 'wikidata': 'https://www.wikidata.org/wiki/Q118301', 'display_name': 'Orthodontics', 'level': 1, 'score': 0.3315248}, {'id': 'https://openalex.org/C71924100', 'wikidata': 'https://www.wikidata.org/wiki/Q11190', 'display_name': 'Medicine', 'level': 0, 'score': 0.2986955}, {'id': 'https://openalex.org/C156887251', 'wikidata': 'https://www.wikidata.org/wiki/Q2386424', 'display_name': 'Enamel paint', 'level': 2, 'score': 0.2631855}]",en,"Caries is the pathological process of hard tissue demineralization in teeth caused by various factors. As a result, necrotic areas within the tooth are formed that require removal and subsequent reconstruction in order to re-establish tooth function. This is achieved by replacing the demineralized areas with dental filling materials. With a wide variety of available dental filling materials, the dentist is faced with the task of choosing the correct material depending on the nature of the lesion. To date, the most widely used permanent filling materials are composites, which constitute one of the largest groups of filling materials. They gained their popularity due to their numerous good qualities, and the continuous research within the field of dental materials enables further improvement of their properties. Currently, a new composite has appeared in dentistry, which helps to neutralize the salivary pH during acidosis, thereby preventing the development of dental caries",,,
3,https://openalex.org/W2070389099,Hybrid composite materials,2008-11-01,"{'openalex': 'https://openalex.org/W2070389099', 'doi': 'https://doi.org/10.1007/s10692-009-9091-4', 'mag': '2070389099'}","{'is_oa': False, 'oa_status': 'closed', 'oa_url': None, 'any_repository_has_fulltext': False}","[{'author_position': 'first', 'author': {'id': 'https://openalex.org/A5075769655', 'display_name': 'С. Е. Артеменко', 'orcid': None}, 'institutions': [{'id': 'https://openalex.org/I177697070', 'display_name': 'Yuri Gagarin State Technical University of Saratov', 'ror': 'https://ror.org/01qn0gc28', 'country_code': 'RU', 'type': 'education', 'lineage': ['https://openalex.org/I177697070']}], 'countries': ['RU'], 'is_corresponding': False, 'raw_author_name': 'S. E. Artemenko', 'raw_affiliation_string': 'Saratov State Technical University', 'raw_affiliation_strings': ['Saratov State Technical University']}, {'author_position': 'last', 'author': {'id': 'https://openalex.org/A5044243235', 'display_name': 'Yu. A. Kadykova', 'orcid': None}, 'institutions': [{'id': 'https://openalex.org/I177697070', 'display_name': 'Yuri Gagarin State Technical University of Saratov', 'ror': 'https://ror.org/01qn0gc28', 'country_code': 'RU', 'type': 'education', 'lineage': ['https://openalex.org/I177697070']}], 'countries': ['RU'], 'is_corresponding': False, 'raw_author_name': 'Yu. A. Kadykova', 'raw_affiliation_string': 'Saratov State Technical University', 'raw_affiliation_strings': ['Saratov State Technical University']}]",[],[],11,"[{'keyword': 'composite materials', 'score': 0.7731}, {'keyword': 'hybrid', 'score': 0.5561}]",,[],2024-01-28T03:21:09.439934,2016-06-24,"[{'id': 'https://openalex.org/C161509811', 'wikidata': 'https://www.wikidata.org/wiki/Q43338', 'display_name': 'Basalt', 'level': 2, 'score': 0.6688608}, {'id': 'https://openalex.org/C140205800', 'wikidata': 'https://www.wikidata.org/wiki/Q5860', 'display_name': 'Carbon fibers', 'level': 3, 'score': 0.58552825}, {'id': 'https://openalex.org/C193483257', 'wikidata': 'https://www.wikidata.org/wiki/Q809762', 'display_name': 'Basalt fiber', 'level': 3, 'score': 0.52698845}, {'id': 'https://openalex.org/C2775951321', 'wikidata': 'https://www.wikidata.org/wiki/Q42329', 'display_name': 'Wool', 'level': 2, 'score': 0.4706746}, {'id': 'https://openalex.org/C104779481', 'wikidata': 'https://www.wikidata.org/wiki/Q50707', 'display_name': 'Composite number', 'level': 2, 'score': 0.45928335}, {'id': 'https://openalex.org/C68189081', 'wikidata': 'https://www.wikidata.org/wiki/Q12748', 'display_name': 'Fossil fuel', 'level': 2, 'score': 0.41602468}, {'id': 'https://openalex.org/C192562407', 'wikidata': 'https://www.wikidata.org/wiki/Q228736', 'display_name': 'Materials science', 'level': 0, 'score': 0.39226887}, {'id': 'https://openalex.org/C39432304', 'wikidata': 'https://www.wikidata.org/wiki/Q188847', 'display_name': 'Environmental science', 'level': 0, 'score': 0.34928972}, {'id': 'https://openalex.org/C159985019', 'wikidata': 'https://www.wikidata.org/wiki/Q181790', 'display_name': 'Composite material', 'level': 1, 'score': 0.34809113}, {'id': 'https://openalex.org/C127313418', 'wikidata': 'https://www.wikidata.org/wiki/Q1069', 'display_name': 'Geology', 'level': 0, 'score': 0.1824719}, {'id': 'https://openalex.org/C548081761', 'wikidata': 'https://www.wikidata.org/wiki/Q180388', 'display_name': 'Waste management', 'level': 1, 'score': 0.17320448}, {'id': 'https://openalex.org/C519885992', 'wikidata': 'https://www.wikidata.org/wiki/Q161', 'display_name': 'Fiber', 'level': 2, 'score': 0.12268442}, {'id': 'https://openalex.org/C127413603', 'wikidata': 'https://www.wikidata.org/wiki/Q11023', 'display_name': 'Engineering', 'level': 0, 'score': 0.11133632}, {'id': 'https://openalex.org/C17409809', 'wikidata': 'https://www.wikidata.org/wiki/Q161764', 'display_name': 'Geochemistry', 'level': 1, 'score': 0.0}]",en,,,,
