,id,title,publication_date,ids,open_access,authorships,corresponding_author_ids,corresponding_institution_ids,cited_by_count,keywords,best_oa_location,grants,updated_date,created_date,concepts,language,abstract,apc_list,apc_paid,referenced_works
71,https://openalex.org/W1989205239,Calcium monosilicates as components of composite materials,2010-08-01,"{'openalex': 'https://openalex.org/W1989205239', 'doi': 'https://doi.org/10.1134/s0040579510040160', 'mag': '1989205239'}","{'is_oa': False, 'oa_status': 'closed', 'oa_url': None, 'any_repository_has_fulltext': False}","[{'author_position': 'first', 'author': {'id': 'https://openalex.org/A5060918071', 'display_name': 'П. С. Гордиенко', 'orcid': None}, 'institutions': [{'id': 'https://openalex.org/I4210097402', 'display_name': 'Institute of Chemistry, Far Eastern Branch of the Russian Academy of Sciences', 'ror': 'https://ror.org/00wp2bj27', 'country_code': 'RU', 'type': 'facility', 'lineage': ['https://openalex.org/I4210097402', 'https://openalex.org/I4210145551', 'https://openalex.org/I4210148470']}, {'id': 'https://openalex.org/I4210112797', 'display_name': 'Institute of Automation and Control Processes', 'ror': 'https://ror.org/02akkm420', 'country_code': 'RU', 'type': 'facility', 'lineage': ['https://openalex.org/I4210112797', 'https://openalex.org/I4210148470']}, {'id': 'https://openalex.org/I1313323035', 'display_name': 'Russian Academy of Sciences', 'ror': 'https://ror.org/05qrfxd25', 'country_code': 'RU', 'type': 'government', 'lineage': ['https://openalex.org/I1313323035']}], 'countries': ['RU'], 'is_corresponding': False, 'raw_author_name': 'P. S. Gordienko', 'raw_affiliation_string': 'Institute of Automatics and Control Processes, Far Eastern Branch, Russian Academy of Sciences, Vladivostok, Russia; Institute of Chemistry, Far Eastern Branch, Russian Academy of Sciences, Vladivostok, Russia', 'raw_affiliation_strings': ['Institute of Automatics and Control Processes, Far Eastern Branch, Russian Academy of Sciences, Vladivostok, Russia', 'Institute of Chemistry, Far Eastern Branch, Russian Academy of Sciences, Vladivostok, Russia']}, {'author_position': 'middle', 'author': {'id': 'https://openalex.org/A5019700104', 'display_name': 'S. B. Yarusova', 'orcid': 'https://orcid.org/0000-0002-1500-1319'}, 'institutions': [{'id': 'https://openalex.org/I4210097402', 'display_name': 'Institute of Chemistry, Far Eastern Branch of the Russian Academy of Sciences', 'ror': 'https://ror.org/00wp2bj27', 'country_code': 'RU', 'type': 'facility', 'lineage': ['https://openalex.org/I4210097402', 'https://openalex.org/I4210145551', 'https://openalex.org/I4210148470']}, {'id': 'https://openalex.org/I4210112797', 'display_name': 'Institute of Automation and Control Processes', 'ror': 'https://ror.org/02akkm420', 'country_code': 'RU', 'type': 'facility', 'lineage': ['https://openalex.org/I4210112797', 'https://openalex.org/I4210148470']}, {'id': 'https://openalex.org/I1313323035', 'display_name': 'Russian Academy of Sciences', 'ror': 'https://ror.org/05qrfxd25', 'country_code': 'RU', 'type': 'government', 'lineage': ['https://openalex.org/I1313323035']}], 'countries': ['RU'], 'is_corresponding': True, 'raw_author_name': 'S. B. Yarusova', 'raw_affiliation_string': 'Institute of Automatics and Control Processes, Far Eastern Branch, Russian Academy of Sciences, Vladivostok, Russia; Institute of Chemistry, Far Eastern Branch, Russian Academy of Sciences, Vladivostok, Russia', 'raw_affiliation_strings': ['Institute of Automatics and Control Processes, Far Eastern Branch, Russian Academy of Sciences, Vladivostok, Russia', 'Institute of Chemistry, Far Eastern Branch, Russian Academy of Sciences, Vladivostok, Russia']}, {'author_position': 'middle', 'author': {'id': 'https://openalex.org/A5018206286', 'display_name': 'С. Б. Буланова', 'orcid': None}, 'institutions': [{'id': 'https://openalex.org/I4210097402', 'display_name': 'Institute of Chemistry, Far Eastern Branch of the Russian Academy of Sciences', 'ror': 'https://ror.org/00wp2bj27', 'country_code': 'RU', 'type': 'facility', 'lineage': ['https://openalex.org/I4210097402', 'https://openalex.org/I4210145551', 'https://openalex.org/I4210148470']}, {'id': 'https://openalex.org/I4210112797', 'display_name': 'Institute of Automation and Control Processes', 'ror': 'https://ror.org/02akkm420', 'country_code': 'RU', 'type': 'facility', 'lineage': ['https://openalex.org/I4210112797', 'https://openalex.org/I4210148470']}, {'id': 'https://openalex.org/I1313323035', 'display_name': 'Russian Academy of Sciences', 'ror': 'https://ror.org/05qrfxd25', 'country_code': 'RU', 'type': 'government', 'lineage': ['https://openalex.org/I1313323035']}], 'countries': ['RU'], 'is_corresponding': False, 'raw_author_name': 'S. B. Bulanova', 'raw_affiliation_string': 'Institute of Automatics and Control Processes, Far Eastern Branch, Russian Academy of Sciences, Vladivostok, Russia; Institute of Chemistry, Far Eastern Branch, Russian Academy of Sciences, Vladivostok, Russia', 'raw_affiliation_strings': ['Institute of Automatics and Control Processes, Far Eastern Branch, Russian Academy of Sciences, Vladivostok, Russia', 'Institute of Chemistry, Far Eastern Branch, Russian Academy of Sciences, Vladivostok, Russia']}, {'author_position': 'middle', 'author': {'id': 'https://openalex.org/A5053830988', 'display_name': 'V. A. Kolzunov', 'orcid': None}, 'institutions': [{'id': 'https://openalex.org/I4210097402', 'display_name': 'Institute of Chemistry, Far Eastern Branch of the Russian Academy of Sciences', 'ror': 'https://ror.org/00wp2bj27', 'country_code': 'RU', 'type': 'facility', 'lineage': ['https://openalex.org/I4210097402', 'https://openalex.org/I4210145551', 'https://openalex.org/I4210148470']}, {'id': 'https://openalex.org/I4210112797', 'display_name': 'Institute of Automation and Control Processes', 'ror': 'https://ror.org/02akkm420', 'country_code': 'RU', 'type': 'facility', 'lineage': ['https://openalex.org/I4210112797', 'https://openalex.org/I4210148470']}, {'id': 'https://openalex.org/I1313323035', 'display_name': 'Russian Academy of Sciences', 'ror': 'https://ror.org/05qrfxd25', 'country_code': 'RU', 'type': 'government', 'lineage': ['https://openalex.org/I1313323035']}], 'countries': ['RU'], 'is_corresponding': False, 'raw_author_name': 'V. A. Kolzunov', 'raw_affiliation_string': 'Institute of Automatics and Control Processes, Far Eastern Branch, Russian Academy of Sciences, Vladivostok, Russia; Institute of Chemistry, Far Eastern Branch, Russian Academy of Sciences, Vladivostok, Russia', 'raw_affiliation_strings': ['Institute of Automatics and Control Processes, Far Eastern Branch, Russian Academy of Sciences, Vladivostok, Russia', 'Institute of Chemistry, Far Eastern Branch, Russian Academy of Sciences, Vladivostok, Russia']}, {'author_position': 'middle', 'author': {'id': 'https://openalex.org/A5020651624', 'display_name': 'А. П. Супонина', 'orcid': None}, 'institutions': [{'id': 'https://openalex.org/I4210097402', 'display_name': 'Institute of Chemistry, Far Eastern Branch of the Russian Academy of Sciences', 'ror': 'https://ror.org/00wp2bj27', 'country_code': 'RU', 'type': 'facility', 'lineage': ['https://openalex.org/I4210097402', 'https://openalex.org/I4210145551', 'https://openalex.org/I4210148470']}, {'id': 'https://openalex.org/I4210112797', 'display_name': 'Institute of Automation and Control Processes', 'ror': 'https://ror.org/02akkm420', 'country_code': 'RU', 'type': 'facility', 'lineage': ['https://openalex.org/I4210112797', 'https://openalex.org/I4210148470']}, {'id': 'https://openalex.org/I1313323035', 'display_name': 'Russian Academy of Sciences', 'ror': 'https://ror.org/05qrfxd25', 'country_code': 'RU', 'type': 'government', 'lineage': ['https://openalex.org/I1313323035']}], 'countries': ['RU'], 'is_corresponding': False, 'raw_author_name': 'A. P. Suponina', 'raw_affiliation_string': 'Institute of Automatics and Control Processes, Far Eastern Branch, Russian Academy of Sciences, Vladivostok, Russia; Institute of Chemistry, Far Eastern Branch, Russian Academy of Sciences, Vladivostok, Russia', 'raw_affiliation_strings': ['Institute of Automatics and Control Processes, Far Eastern Branch, Russian Academy of Sciences, Vladivostok, Russia', 'Institute of Chemistry, Far Eastern Branch, Russian Academy of Sciences, Vladivostok, Russia']}, {'author_position': 'last', 'author': {'id': 'https://openalex.org/A5056659791', 'display_name': 'K. N. Galkin', 'orcid': 'https://orcid.org/0000-0001-5386-1013'}, 'institutions': [{'id': 'https://openalex.org/I4210097402', 'display_name': 'Institute of Chemistry, Far Eastern Branch of the Russian Academy of Sciences', 'ror': 'https://ror.org/00wp2bj27', 'country_code': 'RU', 'type': 'facility', 'lineage': ['https://openalex.org/I4210097402', 'https://openalex.org/I4210145551', 'https://openalex.org/I4210148470']}, {'id': 'https://openalex.org/I4210112797', 'display_name': 'Institute of Automation and Control Processes', 'ror': 'https://ror.org/02akkm420', 'country_code': 'RU', 'type': 'facility', 'lineage': ['https://openalex.org/I4210112797', 'https://openalex.org/I4210148470']}, {'id': 'https://openalex.org/I1313323035', 'display_name': 'Russian Academy of Sciences', 'ror': 'https://ror.org/05qrfxd25', 'country_code': 'RU', 'type': 'government', 'lineage': ['https://openalex.org/I1313323035']}], 'countries': ['RU'], 'is_corresponding': False, 'raw_author_name': 'K. N. Galkin', 'raw_affiliation_string': 'Institute of Automatics and Control Processes, Far Eastern Branch, Russian Academy of Sciences, Vladivostok, Russia; Institute of Chemistry, Far Eastern Branch, Russian Academy of Sciences, Vladivostok, Russia', 'raw_affiliation_strings': ['Institute of Automatics and Control Processes, Far Eastern Branch, Russian Academy of Sciences, Vladivostok, Russia', 'Institute of Chemistry, Far Eastern Branch, Russian Academy of Sciences, Vladivostok, Russia']}]",['https://openalex.org/A5019700104'],"['https://openalex.org/I4210097402', 'https://openalex.org/I4210112797', 'https://openalex.org/I1313323035']",2,"[{'keyword': 'calcium', 'score': 0.585}, {'keyword': 'composite materials', 'score': 0.5479}]",,[],2024-01-29T17:19:50.384414,2016-06-24,"[{'id': 'https://openalex.org/C60100273', 'wikidata': 'https://www.wikidata.org/wiki/Q902806', 'display_name': 'Thermogravimetric analysis', 'level': 2, 'score': 0.9192445}, {'id': 'https://openalex.org/C26771246', 'wikidata': 'https://www.wikidata.org/wiki/Q321095', 'display_name': 'Scanning electron microscope', 'level': 2, 'score': 0.7767235}, {'id': 'https://openalex.org/C104779481', 'wikidata': 'https://www.wikidata.org/wiki/Q50707', 'display_name': 'Composite number', 'level': 2, 'score': 0.6934028}, {'id': 'https://openalex.org/C519063684', 'wikidata': 'https://www.wikidata.org/wiki/Q706', 'display_name': 'Calcium', 'level': 2, 'score': 0.67088944}, {'id': 'https://openalex.org/C192562407', 'wikidata': 'https://www.wikidata.org/wiki/Q228736', 'display_name': 'Materials science', 'level': 0, 'score': 0.5958369}, {'id': 'https://openalex.org/C2777593239', 'wikidata': 'https://www.wikidata.org/wiki/Q193521', 'display_name': 'Titanium dioxide', 'level': 2, 'score': 0.5580109}, {'id': 'https://openalex.org/C207114421', 'wikidata': 'https://www.wikidata.org/wiki/Q133900', 'display_name': 'Diffraction', 'level': 2, 'score': 0.5404542}, {'id': 'https://openalex.org/C506065880', 'wikidata': 'https://www.wikidata.org/wiki/Q716', 'display_name': 'Titanium', 'level': 2, 'score': 0.4627047}, {'id': 'https://openalex.org/C42360764', 'wikidata': 'https://www.wikidata.org/wiki/Q83588', 'display_name': 'Chemical engineering', 'level': 1, 'score': 0.45981842}, {'id': 'https://openalex.org/C159985019', 'wikidata': 'https://www.wikidata.org/wiki/Q181790', 'display_name': 'Composite material', 'level': 1, 'score': 0.45931652}, {'id': 'https://openalex.org/C102951782', 'wikidata': 'https://www.wikidata.org/wiki/Q49295', 'display_name': 'Atomic force microscopy', 'level': 2, 'score': 0.4470265}, {'id': 'https://openalex.org/C77017923', 'wikidata': 'https://www.wikidata.org/wiki/Q912313', 'display_name': 'Optical microscope', 'level': 3, 'score': 0.4382503}, {'id': 'https://openalex.org/C171250308', 'wikidata': 'https://www.wikidata.org/wiki/Q11468', 'display_name': 'Nanotechnology', 'level': 1, 'score': 0.18313491}, {'id': 'https://openalex.org/C120665830', 'wikidata': 'https://www.wikidata.org/wiki/Q14620', 'display_name': 'Optics', 'level': 1, 'score': 0.12187448}, {'id': 'https://openalex.org/C191897082', 'wikidata': 'https://www.wikidata.org/wiki/Q11467', 'display_name': 'Metallurgy', 'level': 1, 'score': 0.12135041}, {'id': 'https://openalex.org/C121332964', 'wikidata': 'https://www.wikidata.org/wiki/Q413', 'display_name': 'Physics', 'level': 0, 'score': 0.0}, {'id': 'https://openalex.org/C127413603', 'wikidata': 'https://www.wikidata.org/wiki/Q11023', 'display_name': 'Engineering', 'level': 0, 'score': 0.0}]",en,,,,
72,https://openalex.org/W2891301088,Composite Moulding Materials based on Polyamidobenzimidazoles,2005-05-01,"{'openalex': 'https://openalex.org/W2891301088', 'doi': 'https://doi.org/10.1177/0307174x0503200512', 'mag': '2891301088'}","{'is_oa': False, 'oa_status': 'closed', 'oa_url': None, 'any_repository_has_fulltext': False}","[{'author_position': 'first', 'author': {'id': 'https://openalex.org/A5068630814', 'display_name': 'Д. М. Могнонов', 'orcid': None}, 'institutions': [{'id': 'https://openalex.org/I4210154476', 'display_name': 'Baikal Institute of Nature Management', 'ror': 'https://ror.org/04850rm18', 'country_code': 'RU', 'type': 'facility', 'lineage': ['https://openalex.org/I4210154476', 'https://openalex.org/I4210163714']}], 'countries': ['RU'], 'is_corresponding': False, 'raw_author_name': 'D. M. Mognonov', 'raw_affiliation_string': 'Baikal Institute of Nature Management of the Siberian Department of the Russian Academy of Sciences, Ulan-Ude, and the D. I. Mendeleev Russian Chemico-Technological Institute, Moscow', 'raw_affiliation_strings': ['Baikal Institute of Nature Management of the Siberian Department of the Russian Academy of Sciences, Ulan-Ude, and the D. I. Mendeleev Russian Chemico-Technological Institute, Moscow']}, {'author_position': 'middle', 'author': {'id': 'https://openalex.org/A5049831643', 'display_name': 'Zh. P. Mazurevskaya', 'orcid': None}, 'institutions': [{'id': 'https://openalex.org/I4210154476', 'display_name': 'Baikal Institute of Nature Management', 'ror': 'https://ror.org/04850rm18', 'country_code': 'RU', 'type': 'facility', 'lineage': ['https://openalex.org/I4210154476', 'https://openalex.org/I4210163714']}], 'countries': ['RU'], 'is_corresponding': False, 'raw_author_name': 'Zh. P. Mazurevskaya', 'raw_affiliation_string': 'Baikal Institute of Nature Management of the Siberian Department of the Russian Academy of Sciences, Ulan-Ude, and the D. I. Mendeleev Russian Chemico-Technological Institute, Moscow', 'raw_affiliation_strings': ['Baikal Institute of Nature Management of the Siberian Department of the Russian Academy of Sciences, Ulan-Ude, and the D. I. Mendeleev Russian Chemico-Technological Institute, Moscow']}, {'author_position': 'last', 'author': {'id': 'https://openalex.org/A5050103901', 'display_name': 'Yu. E. Doroshenko', 'orcid': None}, 'institutions': [{'id': 'https://openalex.org/I4210154476', 'display_name': 'Baikal Institute of Nature Management', 'ror': 'https://ror.org/04850rm18', 'country_code': 'RU', 'type': 'facility', 'lineage': ['https://openalex.org/I4210154476', 'https://openalex.org/I4210163714']}], 'countries': ['RU'], 'is_corresponding': False, 'raw_author_name': 'Yu. E. Doroshenko', 'raw_affiliation_string': 'Baikal Institute of Nature Management of the Siberian Department of the Russian Academy of Sciences, Ulan-Ude, and the D. I. Mendeleev Russian Chemico-Technological Institute, Moscow', 'raw_affiliation_strings': ['Baikal Institute of Nature Management of the Siberian Department of the Russian Academy of Sciences, Ulan-Ude, and the D. I. Mendeleev Russian Chemico-Technological Institute, Moscow']}]",[],[],0,"[{'keyword': 'materials', 'score': 0.3036}]",,[],2024-01-28T12:18:00.882396,2018-09-27,"[{'id': 'https://openalex.org/C104779481', 'wikidata': 'https://www.wikidata.org/wiki/Q50707', 'display_name': 'Composite number', 'level': 2, 'score': 0.7450755}, {'id': 'https://openalex.org/C192562407', 'wikidata': 'https://www.wikidata.org/wiki/Q228736', 'display_name': 'Materials science', 'level': 0, 'score': 0.6466725}, {'id': 'https://openalex.org/C159985019', 'wikidata': 'https://www.wikidata.org/wiki/Q181790', 'display_name': 'Composite material', 'level': 1, 'score': 0.6147435}]",en,,,,
73,https://openalex.org/W4390957890,Composite Photocurable Materials for Repair Purposes,2023-10-01,"{'openalex': 'https://openalex.org/W4390957890', 'doi': 'https://doi.org/10.1134/s0040579523310020'}","{'is_oa': False, 'oa_status': 'closed', 'oa_url': None, 'any_repository_has_fulltext': False}","[{'author_position': 'first', 'author': {'id': 'https://openalex.org/A5063468208', 'display_name': 'O. É. Babkin', 'orcid': None}, 'institutions': [{'id': 'https://openalex.org/I4210085953', 'display_name': 'Saint Petersburg State University of Cinema and Television', 'ror': 'https://ror.org/007vwze84', 'country_code': 'RU', 'type': 'education', 'lineage': ['https://openalex.org/I4210085953']}], 'countries': ['RU'], 'is_corresponding': False, 'raw_author_name': 'O. E. Babkin', 'raw_affiliation_string': 'St. Petersburg State Institute of Film and Television, 191119, St. Petersburg, Russia', 'raw_affiliation_strings': ['St. Petersburg State Institute of Film and Television, 191119, St. Petersburg, Russia']}, {'author_position': 'middle', 'author': {'id': 'https://openalex.org/A5061037511', 'display_name': 'L. A. Babkina', 'orcid': None}, 'institutions': [], 'countries': ['RU'], 'is_corresponding': False, 'raw_author_name': 'L. A. Babkina', 'raw_affiliation_string': 'S&H Technology, 198216, St. Petersburg, Russia', 'raw_affiliation_strings': ['S&H Technology, 198216, St. Petersburg, Russia']}, {'author_position': 'middle', 'author': {'id': 'https://openalex.org/A5001723237', 'display_name': 'В. В. Ильина', 'orcid': None}, 'institutions': [{'id': 'https://openalex.org/I4210085953', 'display_name': 'Saint Petersburg State University of Cinema and Television', 'ror': 'https://ror.org/007vwze84', 'country_code': 'RU', 'type': 'education', 'lineage': ['https://openalex.org/I4210085953']}], 'countries': ['RU'], 'is_corresponding': False, 'raw_author_name': 'V. V. Il’ina', 'raw_affiliation_string': 'St. Petersburg State Institute of Film and Television, 191119, St. Petersburg, Russia', 'raw_affiliation_strings': ['St. Petersburg State Institute of Film and Television, 191119, St. Petersburg, Russia']}, {'author_position': 'middle', 'author': {'id': 'https://openalex.org/A5074447228', 'display_name': 'O. S. Aikasheva', 'orcid': None}, 'institutions': [], 'countries': ['NL'], 'is_corresponding': False, 'raw_author_name': 'O. S. Aikasheva', 'raw_affiliation_string': 'PPG Industries, Amsterdam, Netherlands', 'raw_affiliation_strings': ['PPG Industries, Amsterdam, Netherlands']}, {'author_position': 'last', 'author': {'id': 'https://openalex.org/A5042524393', 'display_name': 'K. V. Izotova', 'orcid': None}, 'institutions': [], 'countries': ['RU'], 'is_corresponding': False, 'raw_author_name': 'K. V. Izotova', 'raw_affiliation_string': 'S&H Technology, 198216, St. Petersburg, Russia', 'raw_affiliation_strings': ['S&H Technology, 198216, St. Petersburg, Russia']}]",[],[],0,[],,[],2024-02-01T02:34:28.224724,2024-01-18,"[{'id': 'https://openalex.org/C192562407', 'wikidata': 'https://www.wikidata.org/wiki/Q228736', 'display_name': 'Materials science', 'level': 0, 'score': 0.6686229}, {'id': 'https://openalex.org/C43521106', 'wikidata': 'https://www.wikidata.org/wiki/Q2165493', 'display_name': 'Pipeline (software)', 'level': 2, 'score': 0.543271}, {'id': 'https://openalex.org/C159985019', 'wikidata': 'https://www.wikidata.org/wiki/Q181790', 'display_name': 'Composite material', 'level': 1, 'score': 0.51350576}, {'id': 'https://openalex.org/C104779481', 'wikidata': 'https://www.wikidata.org/wiki/Q50707', 'display_name': 'Composite number', 'level': 2, 'score': 0.50160456}, {'id': 'https://openalex.org/C68928338', 'wikidata': 'https://www.wikidata.org/wiki/Q131790', 'display_name': 'Adhesive', 'level': 3, 'score': 0.49827123}, {'id': 'https://openalex.org/C175309249', 'wikidata': 'https://www.wikidata.org/wiki/Q725864', 'display_name': 'Pipeline transport', 'level': 2, 'score': 0.47288054}, {'id': 'https://openalex.org/C78519656', 'wikidata': 'https://www.wikidata.org/wiki/Q101333', 'display_name': 'Mechanical engineering', 'level': 1, 'score': 0.12725332}, {'id': 'https://openalex.org/C127413603', 'wikidata': 'https://www.wikidata.org/wiki/Q11023', 'display_name': 'Engineering', 'level': 0, 'score': 0.09147018}, {'id': 'https://openalex.org/C2779227376', 'wikidata': 'https://www.wikidata.org/wiki/Q6505497', 'display_name': 'Layer (electronics)', 'level': 2, 'score': 0.0}]",en,,,,
74,https://openalex.org/W4388951354,"Polymers, Composites, Alloys and Special Materials",2023-04-20,"{'openalex': 'https://openalex.org/W4388951354', 'doi': 'https://doi.org/10.4028/b-0rcwwh'}","{'is_oa': False, 'oa_status': 'closed', 'oa_url': None, 'any_repository_has_fulltext': False}","[{'author_position': 'first', 'author': {'id': 'https://openalex.org/A5014266650', 'display_name': 'Ian McAndrew', 'orcid': None}, 'institutions': [{'id': 'https://openalex.org/I98993165', 'display_name': 'Capitol Technology University', 'ror': 'https://ror.org/045ej2q36', 'country_code': 'US', 'type': 'education', 'lineage': ['https://openalex.org/I98993165']}], 'countries': ['US'], 'is_corresponding': False, 'raw_author_name': 'Ian McAndrew', 'raw_affiliation_string': 'Capitol Technology University', 'raw_affiliation_strings': ['Capitol Technology University']}, {'author_position': 'middle', 'author': {'id': 'https://openalex.org/A5003842852', 'display_name': 'Denis B. Solovev', 'orcid': 'https://orcid.org/0000-0001-9988-8182'}, 'institutions': [{'id': 'https://openalex.org/I204947315', 'display_name': 'Far Eastern Federal University', 'ror': 'https://ror.org/0412y9z21', 'country_code': 'RU', 'type': 'education', 'lineage': ['https://openalex.org/I204947315']}], 'countries': ['RU'], 'is_corresponding': False, 'raw_author_name': 'Denis B. Solovev', 'raw_affiliation_string': 'Far Eastern Federal University', 'raw_affiliation_strings': ['Far Eastern Federal University']}, {'author_position': 'middle', 'author': {'id': 'https://openalex.org/A5069681794', 'display_name': 'Kuldeep K. Saxena', 'orcid': 'https://orcid.org/0000-0003-4064-5113'}, 'institutions': [{'id': 'https://openalex.org/I82571370', 'display_name': 'GLA University', 'ror': 'https://ror.org/05fnxgv12', 'country_code': 'IN', 'type': 'education', 'lineage': ['https://openalex.org/I82571370']}], 'countries': ['IN'], 'is_corresponding': False, 'raw_author_name': 'Kuldeep Kumar Saxena', 'raw_affiliation_string': 'GLA University', 'raw_affiliation_strings': ['GLA University']}, {'author_position': 'last', 'author': {'id': 'https://openalex.org/A5060450544', 'display_name': 'Katsuyuki Kida', 'orcid': None}, 'institutions': [{'id': 'https://openalex.org/I42766147', 'display_name': 'University of Toyama', 'ror': 'https://ror.org/0445phv87', 'country_code': 'JP', 'type': 'education', 'lineage': ['https://openalex.org/I42766147']}], 'countries': ['JP'], 'is_corresponding': False, 'raw_author_name': 'Katsuyuki Kida', 'raw_affiliation_string': 'University of Toyama', 'raw_affiliation_strings': ['University of Toyama']}]",[],[],0,[],,[],2024-02-01T23:03:32.686043,2023-11-24,"[{'id': 'https://openalex.org/C192562407', 'wikidata': 'https://www.wikidata.org/wiki/Q228736', 'display_name': 'Materials science', 'level': 0, 'score': 0.7433738}, {'id': 'https://openalex.org/C159985019', 'wikidata': 'https://www.wikidata.org/wiki/Q181790', 'display_name': 'Composite material', 'level': 1, 'score': 0.7179077}, {'id': 'https://openalex.org/C521977710', 'wikidata': 'https://www.wikidata.org/wiki/Q81163', 'display_name': 'Polymer', 'level': 2, 'score': 0.609244}, {'id': 'https://openalex.org/C126348684', 'wikidata': 'https://www.wikidata.org/wiki/Q3456979', 'display_name': 'Polymer science', 'level': 1, 'score': 0.39615762}]",en,,,,
