,id,title,publication_date,ids,open_access,authorships,corresponding_author_ids,corresponding_institution_ids,apc_list,apc_paid,cited_by_count,keywords,best_oa_location,grants,referenced_works,updated_date,created_date,concepts,language,abstract
0,https://openalex.org/W2942446037,Recent advances in cavity-based scramjet engine- a brief review,2019-05-01,"{'openalex': 'https://openalex.org/W2942446037', 'doi': 'https://doi.org/10.1016/j.ijhydene.2019.04.003', 'mag': '2942446037'}","{'is_oa': False, 'oa_status': 'closed', 'oa_url': None, 'any_repository_has_fulltext': False}","[{'author_position': 'first', 'author': {'id': 'https://openalex.org/A5057035510', 'display_name': 'Gautam Choubey', 'orcid': 'https://orcid.org/0000-0003-4266-6356'}, 'institutions': [], 'countries': ['IN'], 'is_corresponding': True, 'raw_author_name': 'Gautam Choubey', 'raw_affiliation_string': 'Department of Mechanical Engineering, MITS-UGC Autonomous Institute, Andhra Pradesh, 517325, India', 'raw_affiliation_strings': ['Department of Mechanical Engineering, MITS-UGC Autonomous Institute, Andhra Pradesh, 517325, India']}, {'author_position': 'middle', 'author': {'id': 'https://openalex.org/A5083157732', 'display_name': 'Yuvarajan Devarajan', 'orcid': 'https://orcid.org/0000-0002-7617-167X'}, 'institutions': [], 'countries': ['IN'], 'is_corresponding': False, 'raw_author_name': 'Yuvarajan Devarajan', 'raw_affiliation_string': 'Department of Mechanical Engineering, MITS-UGC Autonomous Institute, Andhra Pradesh, 517325, India', 'raw_affiliation_strings': ['Department of Mechanical Engineering, MITS-UGC Autonomous Institute, Andhra Pradesh, 517325, India']}, {'author_position': 'middle', 'author': {'id': 'https://openalex.org/A5040750454', 'display_name': 'Wei Huang', 'orcid': 'https://orcid.org/0000-0001-9805-985X'}, 'institutions': [{'id': 'https://openalex.org/I170215575', 'display_name': 'National University of Defense Technology', 'ror': 'https://ror.org/05d2yfz11', 'country_code': 'CN', 'type': 'education', 'lineage': ['https://openalex.org/I170215575']}], 'countries': ['CN'], 'is_corresponding': False, 'raw_author_name': 'Wei Huang', 'raw_affiliation_string': 'Science and Technology on Scramjet Laboratory, National University of Defense Technology, Changsha, Hunan 410073, PR China', 'raw_affiliation_strings': ['Science and Technology on Scramjet Laboratory, National University of Defense Technology, Changsha, Hunan 410073, PR China']}, {'author_position': 'middle', 'author': {'id': 'https://openalex.org/A5058811678', 'display_name': 'Kulmani Mehar', 'orcid': None}, 'institutions': [], 'countries': ['IN'], 'is_corresponding': False, 'raw_author_name': 'Kulmani Mehar', 'raw_affiliation_string': 'Department of Mechanical Engineering, MITS-UGC Autonomous Institute, Andhra Pradesh, 517325, India', 'raw_affiliation_strings': ['Department of Mechanical Engineering, MITS-UGC Autonomous Institute, Andhra Pradesh, 517325, India']}, {'author_position': 'middle', 'author': {'id': 'https://openalex.org/A5027097512', 'display_name': 'Manvendra Tiwari', 'orcid': 'https://orcid.org/0000-0002-2647-1180'}, 'institutions': [], 'countries': ['IN'], 'is_corresponding': False, 'raw_author_name': 'Manvendra Tiwari', 'raw_affiliation_string': 'Department of Mechanical Engineering, MITS-UGC Autonomous Institute, Andhra Pradesh, 517325, India', 'raw_affiliation_strings': ['Department of Mechanical Engineering, MITS-UGC Autonomous Institute, Andhra Pradesh, 517325, India']}, {'author_position': 'last', 'author': {'id': 'https://openalex.org/A5022121582', 'display_name': 'Krishna Murari Pandey', 'orcid': 'https://orcid.org/0000-0001-7885-0353'}, 'institutions': [{'id': 'https://openalex.org/I151903974', 'display_name': 'National Institute Of Technology Silchar', 'ror': 'https://ror.org/001ws2a36', 'country_code': 'IN', 'type': 'education', 'lineage': ['https://openalex.org/I151903974']}], 'countries': ['IN'], 'is_corresponding': False, 'raw_author_name': 'K.M. Pandey', 'raw_affiliation_string': 'Department of Mechanical Engineering, National Institute of Technology Silchar, Assam, India', 'raw_affiliation_strings': ['Department of Mechanical Engineering, National Institute of Technology Silchar, Assam, India']}]",['https://openalex.org/A5057035510'],[],"{'value': 3400, 'currency': 'USD', 'value_usd': 3400, 'provenance': 'doaj'}","{'value': 3400, 'currency': 'USD', 'value_usd': 3400, 'provenance': 'doaj'}",159,"[{'keyword': 'scramjet', 'score': 0.5782}, {'keyword': 'cavity-based', 'score': 0.25}]",,[],"['https://openalex.org/W625684168', 'https://openalex.org/W640918263', 'https://openalex.org/W820533330', 'https://openalex.org/W1189929239', 'https://openalex.org/W1478004616', 'https://openalex.org/W1819935469', 'https://openalex.org/W1970546333', 'https://openalex.org/W1972302670', 'https://openalex.org/W1974164591', 'https://openalex.org/W1978794180', 'https://openalex.org/W1980691424', 'https://openalex.org/W1981317976', 'https://openalex.org/W1981637582', 'https://openalex.org/W1981813364', 'https://openalex.org/W1984136717', 'https://openalex.org/W1986480538', 'https://openalex.org/W1991346550', 'https://openalex.org/W1992046475', 'https://openalex.org/W1993020779', 'https://openalex.org/W1996513324', 'https://openalex.org/W2001688933', 'https://openalex.org/W2006479313', 'https://openalex.org/W2009223328', 'https://openalex.org/W2014757373', 'https://openalex.org/W2016292053', 'https://openalex.org/W2020484606', 'https://openalex.org/W2024832907', 'https://openalex.org/W2025871829', 'https://openalex.org/W2028706114', 'https://openalex.org/W2034313030', 'https://openalex.org/W2034328480', 'https://openalex.org/W2035093581', 'https://openalex.org/W2041456586', 'https://openalex.org/W2041746156', 'https://openalex.org/W2052175032', 'https://openalex.org/W2052548356', 'https://openalex.org/W2052571407', 'https://openalex.org/W2053000905', 'https://openalex.org/W2059022028', 'https://openalex.org/W2059695882', 'https://openalex.org/W2060939979', 'https://openalex.org/W2069449307', 'https://openalex.org/W2074368208', 'https://openalex.org/W2077993436', 'https://openalex.org/W2089601214', 'https://openalex.org/W2092817474', 'https://openalex.org/W2093962177', 'https://openalex.org/W2096387517', 'https://openalex.org/W2097009753', 'https://openalex.org/W2116744677', 'https://openalex.org/W2117760436', 'https://openalex.org/W2129689672', 'https://openalex.org/W2146454198', 'https://openalex.org/W2154025038', 'https://openalex.org/W2220022329', 'https://openalex.org/W2227645718', 'https://openalex.org/W2233098960', 'https://openalex.org/W2262183875', 'https://openalex.org/W2268654036', 'https://openalex.org/W2319709513', 'https://openalex.org/W2344476636', 'https://openalex.org/W2408184302', 'https://openalex.org/W2408751301', 'https://openalex.org/W2508558308', 'https://openalex.org/W2511043406', 'https://openalex.org/W2527753504', 'https://openalex.org/W2534981495', 'https://openalex.org/W2558559276', 'https://openalex.org/W2560017078', 'https://openalex.org/W2573111205', 'https://openalex.org/W2581984541', 'https://openalex.org/W2592778244', 'https://openalex.org/W2599637247', 'https://openalex.org/W2605342069', 'https://openalex.org/W2607966241', 'https://openalex.org/W2624656372', 'https://openalex.org/W2737582959', 'https://openalex.org/W2737597770', 'https://openalex.org/W2738879339', 'https://openalex.org/W2740700253', 'https://openalex.org/W2742252929', 'https://openalex.org/W2762801467', 'https://openalex.org/W2789681368', 'https://openalex.org/W2790065290', 'https://openalex.org/W2791231468', 'https://openalex.org/W2793736439', 'https://openalex.org/W2795193865', 'https://openalex.org/W2800206317', 'https://openalex.org/W2800552152', 'https://openalex.org/W2801785697', 'https://openalex.org/W2808555831', 'https://openalex.org/W2810020585', 'https://openalex.org/W2810573212', 'https://openalex.org/W2826470594', 'https://openalex.org/W2883376054', 'https://openalex.org/W2884679251', 'https://openalex.org/W2889073061', 'https://openalex.org/W2898017640', 'https://openalex.org/W2900823351', 'https://openalex.org/W2916285555', 'https://openalex.org/W4245073275']",2024-01-27T23:05:59.580129,2019-05-03,"[{'id': 'https://openalex.org/C56278489', 'wikidata': 'https://www.wikidata.org/wiki/Q60591', 'display_name': 'Scramjet', 'level': 4, 'score': 0.96357036}, {'id': 'https://openalex.org/C83104080', 'wikidata': 'https://www.wikidata.org/wiki/Q3809680', 'display_name': 'Combustor', 'level': 3, 'score': 0.87898207}, {'id': 'https://openalex.org/C159063594', 'wikidata': 'https://www.wikidata.org/wiki/Q248382', 'display_name': 'Ignition system', 'level': 2, 'score': 0.5852118}, {'id': 'https://openalex.org/C146978453', 'wikidata': 'https://www.wikidata.org/wiki/Q3798668', 'display_name': 'Aerospace engineering', 'level': 1, 'score': 0.58287483}, {'id': 'https://openalex.org/C9526370', 'wikidata': 'https://www.wikidata.org/wiki/Q308881', 'display_name': 'Fuel injection', 'level': 2, 'score': 0.5448896}, {'id': 'https://openalex.org/C192562407', 'wikidata': 'https://www.wikidata.org/wiki/Q228736', 'display_name': 'Materials science', 'level': 0, 'score': 0.5079594}, {'id': 'https://openalex.org/C138777275', 'wikidata': 'https://www.wikidata.org/wiki/Q6884054', 'display_name': 'Mixing (physics)', 'level': 2, 'score': 0.48171192}, {'id': 'https://openalex.org/C105923489', 'wikidata': 'https://www.wikidata.org/wiki/Q133235', 'display_name': 'Combustion', 'level': 2, 'score': 0.47535393}, {'id': 'https://openalex.org/C78519656', 'wikidata': 'https://www.wikidata.org/wiki/Q101333', 'display_name': 'Mechanical engineering', 'level': 1, 'score': 0.3419082}, {'id': 'https://openalex.org/C171146098', 'wikidata': 'https://www.wikidata.org/wiki/Q124192', 'display_name': 'Automotive engineering', 'level': 1, 'score': 0.33716434}, {'id': 'https://openalex.org/C127413603', 'wikidata': 'https://www.wikidata.org/wiki/Q11023', 'display_name': 'Engineering', 'level': 0, 'score': 0.25300843}, {'id': 'https://openalex.org/C121332964', 'wikidata': 'https://www.wikidata.org/wiki/Q413', 'display_name': 'Physics', 'level': 0, 'score': 0.15266183}, {'id': 'https://openalex.org/C185592680', 'wikidata': 'https://www.wikidata.org/wiki/Q2329', 'display_name': 'Chemistry', 'level': 0, 'score': 0.13950029}, {'id': 'https://openalex.org/C178790620', 'wikidata': 'https://www.wikidata.org/wiki/Q11351', 'display_name': 'Organic chemistry', 'level': 1, 'score': 0.0}, {'id': 'https://openalex.org/C62520636', 'wikidata': 'https://www.wikidata.org/wiki/Q944', 'display_name': 'Quantum mechanics', 'level': 1, 'score': 0.0}]",en,"At present, the critical issue related to design of scramjet engine is to achieve efficient mixing between the air and fuel. Among the several fuel injection strategies, cavity flame holder is identified as a well-organized method for supporting the ignition zone. In this review, some mixing enhancement approaches based on well-known cavity based injection scheme proposed in latest research works, are summarized in detailed. The influence of cavity on the performance of scramjet combustor is recapitulated from three aspects, namely variation of shape/geometry of cavity flame holder; location of fuel/air injection scheme; and recent progresses in dual/double cavity. This review reveals that the cavity rear wall-expansion is an innovative kind of cavity flame holder which has a great impact on the efficiency of scramjet combustor whereas the presence of micro air jets have improved the flame holding mechanism of scramjet engine. Additionally, the performance of scramjet is significantly improved by dual cavity indicating that the dual cavity flame holder would be a feasible preference for the future growth of scramjet engine."
1,https://openalex.org/W4252497720,Introduction,2020-01-01,"{'openalex': 'https://openalex.org/W4252497720', 'doi': 'https://doi.org/10.1016/b978-0-12-821138-0.00001-x'}","{'is_oa': False, 'oa_status': 'closed', 'oa_url': None, 'any_repository_has_fulltext': False}","[{'author_position': 'first', 'author': {'id': 'https://openalex.org/A5044592175', 'display_name': 'M. Barzegar Gerdroodbary', 'orcid': 'https://orcid.org/0000-0002-8243-9476'}, 'institutions': [{'id': 'https://openalex.org/I84248293', 'display_name': 'Babol Noshirvani University of Technology', 'ror': 'https://ror.org/02zc85170', 'country_code': 'IR', 'type': 'education', 'lineage': ['https://openalex.org/I84248293']}], 'countries': ['IR'], 'is_corresponding': True, 'raw_author_name': 'Mostafa Barzegar Gerdroodbary', 'raw_affiliation_string': 'Department of Mechanical Engineering, Babol Noshirvani University of Technology, Babol, Iran', 'raw_affiliation_strings': ['Department of Mechanical Engineering, Babol Noshirvani University of Technology, Babol, Iran']}]",['https://openalex.org/A5044592175'],['https://openalex.org/I84248293'],,,10,"[{'keyword': 'introduction', 'score': 1.0}]",,[],,2024-01-27T11:59:51.877925,2022-05-12,"[{'id': 'https://openalex.org/C56278489', 'wikidata': 'https://www.wikidata.org/wiki/Q60591', 'display_name': 'Scramjet', 'level': 4, 'score': 0.89557314}, {'id': 'https://openalex.org/C146978453', 'wikidata': 'https://www.wikidata.org/wiki/Q3798668', 'display_name': 'Aerospace engineering', 'level': 1, 'score': 0.5167055}, {'id': 'https://openalex.org/C2985438705', 'wikidata': 'https://www.wikidata.org/wiki/Q743004', 'display_name': 'Aero engine', 'level': 2, 'score': 0.48342764}, {'id': 'https://openalex.org/C127413603', 'wikidata': 'https://www.wikidata.org/wiki/Q11023', 'display_name': 'Engineering', 'level': 0, 'score': 0.44913}, {'id': 'https://openalex.org/C178802073', 'wikidata': 'https://www.wikidata.org/wiki/Q8421', 'display_name': 'Aeronautics', 'level': 1, 'score': 0.32915097}, {'id': 'https://openalex.org/C171146098', 'wikidata': 'https://www.wikidata.org/wiki/Q124192', 'display_name': 'Automotive engineering', 'level': 1, 'score': 0.32482764}, {'id': 'https://openalex.org/C78519656', 'wikidata': 'https://www.wikidata.org/wiki/Q101333', 'display_name': 'Mechanical engineering', 'level': 1, 'score': 0.15638489}, {'id': 'https://openalex.org/C83104080', 'wikidata': 'https://www.wikidata.org/wiki/Q3809680', 'display_name': 'Combustor', 'level': 3, 'score': 0.10615581}, {'id': 'https://openalex.org/C105923489', 'wikidata': 'https://www.wikidata.org/wiki/Q133235', 'display_name': 'Combustion', 'level': 2, 'score': 0.08150232}, {'id': 'https://openalex.org/C185592680', 'wikidata': 'https://www.wikidata.org/wiki/Q2329', 'display_name': 'Chemistry', 'level': 0, 'score': 0.04089433}, {'id': 'https://openalex.org/C178790620', 'wikidata': 'https://www.wikidata.org/wiki/Q11351', 'display_name': 'Organic chemistry', 'level': 1, 'score': 0.0}]",en,"In this chapter, the main challenges for the invention of the scramjet engine is fully presented. The primary configurations for achieving the recent scramjet engine are also reviewed. The non-dimensional parameters are presented and the main advance centers for the development of the scramjet engine are introduced. Besides, the main parts of the scramjet engine is introduced and their roles on the scramjet engine is determined. In addition, required fuel types for different flight ranges are described."
2,https://openalex.org/W2115561360,The program for the complex investigation of the hypersonic flight laboratory (HFL) 'IGLA' in the PGU of TSNIIMASH,2001-04-24,"{'openalex': 'https://openalex.org/W2115561360', 'doi': 'https://doi.org/10.2514/6.2001-1875', 'mag': '2115561360'}","{'is_oa': False, 'oa_status': 'closed', 'oa_url': None, 'any_repository_has_fulltext': False}","[{'author_position': 'first', 'author': {'id': 'https://openalex.org/A5073421510', 'display_name': 'V. Semenov', 'orcid': None}, 'institutions': [], 'countries': ['RU'], 'is_corresponding': False, 'raw_author_name': 'V. Semenov', 'raw_affiliation_string': 'CIAMB, Moscow, Russia', 'raw_affiliation_strings': ['CIAMB, Moscow, Russia']}, {'author_position': 'middle', 'author': {'id': 'https://openalex.org/A5021163632', 'display_name': 'Vitaly Kislykh', 'orcid': None}, 'institutions': [{'id': 'https://openalex.org/I52158987', 'display_name': 'Central Research Institute of Mechanical Engineering', 'ror': 'https://ror.org/02tx80f61', 'country_code': 'RU', 'type': 'facility', 'lineage': ['https://openalex.org/I52158987']}], 'countries': ['RU'], 'is_corresponding': False, 'raw_author_name': 'V. Kislykh', 'raw_affiliation_string': 'TsNIIMASh, Korolev, Russia', 'raw_affiliation_strings': ['TsNIIMASh, Korolev, Russia']}, {'author_position': 'last', 'author': {'id': 'https://openalex.org/A5040115078', 'display_name': 'A. A. Kondratov', 'orcid': 'https://orcid.org/0009-0007-4634-4684'}, 'institutions': [], 'countries': ['RU'], 'is_corresponding': False, 'raw_author_name': 'A. Kondratov', 'raw_affiliation_string': 'LII, Zhukovsky, Russia', 'raw_affiliation_strings': ['LII, Zhukovsky, Russia']}]",[],[],,,1,"[{'keyword': 'hypersonic flight laboratory', 'score': 0.6454}, {'keyword': 'igla', 'score': 0.5141}, {'keyword': 'complex investigation', 'score': 0.2732}]",,[],,2024-02-02T23:49:35.053877,2016-06-24,"[{'id': 'https://openalex.org/C178802073', 'wikidata': 'https://www.wikidata.org/wiki/Q8421', 'display_name': 'Aeronautics', 'level': 1, 'score': 0.69948876}, {'id': 'https://openalex.org/C146978453', 'wikidata': 'https://www.wikidata.org/wiki/Q3798668', 'display_name': 'Aerospace engineering', 'level': 1, 'score': 0.5858906}, {'id': 'https://openalex.org/C122824865', 'wikidata': 'https://www.wikidata.org/wiki/Q830787', 'display_name': 'Hypersonic speed', 'level': 2, 'score': 0.5793558}, {'id': 'https://openalex.org/C198813307', 'wikidata': 'https://www.wikidata.org/wiki/Q3523908', 'display_name': 'Hypersonic flight', 'level': 3, 'score': 0.5232429}, {'id': 'https://openalex.org/C41008148', 'wikidata': 'https://www.wikidata.org/wiki/Q21198', 'display_name': 'Computer science', 'level': 0, 'score': 0.44552225}, {'id': 'https://openalex.org/C127413603', 'wikidata': 'https://www.wikidata.org/wiki/Q11023', 'display_name': 'Engineering', 'level': 0, 'score': 0.35531408}]",en,"Experimental investigations of characteristi cs of the flying models (demonstrators) like Hyper-X etc in on-ground test facilities are conducted now in the network of hypersonic technology development. Testing of the scramjet unit on autonomous hypersonic flight lab (HFL) Igla of length Ly~8 m is scheduled in CIAMB together with a number of other research organizations. On-ground testing of HFL flight regimes sufficient for beginning of real-flight tests is carried out in a number of facilities 2'3 using models and full-scale vehicle sections of the scramjet to provide vehicle stability, flight control and strength conditions with account for operating scramjet at its autonomous flight. The program, methods and principles of operation of piston gasdynamic unit (PGU) with multicascade compression (MCC) for complex investigation of characteristics of the HFL and scramjet section under conditions closely approaching to the real flight are described in the paper. The first stage of the Igla HFL pre-model tests in the PGU-7 for Mach numbers ~ 10,13 are also presented in the paper."
3,https://openalex.org/W4205735414,Optimization of Multi-stage Cooling Systemâ€™s Performance for Hydrogen Fueled Scramjet,2022-01-01,"{'openalex': 'https://openalex.org/W4205735414', 'doi': 'https://doi.org/10.1007/978-3-030-90720-4_12'}","{'is_oa': False, 'oa_status': 'closed', 'oa_url': None, 'any_repository_has_fulltext': False}","[{'author_position': 'first', 'author': {'id': 'https://openalex.org/A5004730185', 'display_name': 'Pourya Seyedmatin', 'orcid': None}, 'institutions': [{'id': 'https://openalex.org/I1516879', 'display_name': 'Tarbiat Modares University', 'ror': 'https://ror.org/03mwgfy56', 'country_code': 'IR', 'type': 'education', 'lineage': ['https://openalex.org/I1516879']}, {'id': 'https://openalex.org/I23946033', 'display_name': 'University of Tehran', 'ror': 'https://ror.org/05vf56z40', 'country_code': 'IR', 'type': 'education', 'lineage': ['https://openalex.org/I23946033']}], 'countries': ['IR'], 'is_corresponding': False, 'raw_author_name': 'Pourya Seyedmatin', 'raw_affiliation_string': 'Tarbiat Modares University of Tehran, Tehran, Iran', 'raw_affiliation_strings': ['Tarbiat Modares University of Tehran, Tehran, Iran']}, {'author_position': 'middle', 'author': {'id': 'https://openalex.org/A5016194884', 'display_name': 'Mohammad Ebadollahi', 'orcid': 'https://orcid.org/0000-0002-0048-6915'}, 'institutions': [{'id': 'https://openalex.org/I80543232', 'display_name': 'K.N.Toosi University of Technology', 'ror': 'https://ror.org/0433abe34', 'country_code': 'IR', 'type': 'education', 'lineage': ['https://openalex.org/I80543232']}], 'countries': ['IR'], 'is_corresponding': False, 'raw_author_name': 'Mohammad Ebadollahi', 'raw_affiliation_string': 'Khajeh Nasir Toosi University of Technology, Tehran, Iran', 'raw_affiliation_strings': ['Khajeh Nasir Toosi University of Technology, Tehran, Iran']}, {'author_position': 'middle', 'author': {'id': 'https://openalex.org/A5066653610', 'display_name': 'Mojtaba Bezaatpour', 'orcid': 'https://orcid.org/0000-0001-6570-0612'}, 'institutions': [{'id': 'https://openalex.org/I107853901', 'display_name': 'Sahand University of Technology', 'ror': 'https://ror.org/03wdrmh81', 'country_code': 'IR', 'type': 'education', 'lineage': ['https://openalex.org/I107853901']}], 'countries': ['IR'], 'is_corresponding': False, 'raw_author_name': 'Mojtaba Bezaatpour', 'raw_affiliation_string': 'Sahand University of Technology, Tabriz, Iran', 'raw_affiliation_strings': ['Sahand University of Technology, Tabriz, Iran']}, {'author_position': 'last', 'author': {'id': 'https://openalex.org/A5056424464', 'display_name': 'Majid Amidpour', 'orcid': 'https://orcid.org/0000-0003-2073-6106'}, 'institutions': [{'id': 'https://openalex.org/I80543232', 'display_name': 'K.N.Toosi University of Technology', 'ror': 'https://ror.org/0433abe34', 'country_code': 'IR', 'type': 'education', 'lineage': ['https://openalex.org/I80543232']}], 'countries': ['IR'], 'is_corresponding': True, 'raw_author_name': 'Majid Amidpour', 'raw_affiliation_string': 'Khajeh Nasir Toosi University of Technology, Tehran, Iran', 'raw_affiliation_strings': ['Khajeh Nasir Toosi University of Technology, Tehran, Iran']}]",['https://openalex.org/A5056424464'],['https://openalex.org/I80543232'],,,1,"[{'keyword': 'hydrogen', 'score': 0.2593}, {'keyword': 'multi-stage', 'score': 0.25}]",,[],,2024-02-02T19:59:26.053003,2022-01-26,"[{'id': 'https://openalex.org/C56278489', 'wikidata': 'https://www.wikidata.org/wiki/Q60591', 'display_name': 'Scramjet', 'level': 4, 'score': 0.8034131}, {'id': 'https://openalex.org/C184235594', 'wikidata': 'https://www.wikidata.org/wiki/Q288706', 'display_name': 'Waste heat', 'level': 3, 'score': 0.48440748}, {'id': 'https://openalex.org/C21880701', 'wikidata': 'https://www.wikidata.org/wiki/Q2144042', 'display_name': 'Process engineering', 'level': 1, 'score': 0.43994308}, {'id': 'https://openalex.org/C105923489', 'wikidata': 'https://www.wikidata.org/wiki/Q133235', 'display_name': 'Combustion', 'level': 2, 'score': 0.42814514}, {'id': 'https://openalex.org/C127413603', 'wikidata': 'https://www.wikidata.org/wiki/Q11023', 'display_name': 'Engineering', 'level': 0, 'score': 0.3917379}, {'id': 'https://openalex.org/C171146098', 'wikidata': 'https://www.wikidata.org/wiki/Q124192', 'display_name': 'Automotive engineering', 'level': 1, 'score': 0.38135704}, {'id': 'https://openalex.org/C548081761', 'wikidata': 'https://www.wikidata.org/wiki/Q180388', 'display_name': 'Waste management', 'level': 1, 'score': 0.3403501}, {'id': 'https://openalex.org/C78519656', 'wikidata': 'https://www.wikidata.org/wiki/Q101333', 'display_name': 'Mechanical engineering', 'level': 1, 'score': 0.26567876}, {'id': 'https://openalex.org/C107706546', 'wikidata': 'https://www.wikidata.org/wiki/Q189124', 'display_name': 'Heat exchanger', 'level': 2, 'score': 0.07932216}, {'id': 'https://openalex.org/C185592680', 'wikidata': 'https://www.wikidata.org/wiki/Q2329', 'display_name': 'Chemistry', 'level': 0, 'score': 0.07242566}, {'id': 'https://openalex.org/C83104080', 'wikidata': 'https://www.wikidata.org/wiki/Q3809680', 'display_name': 'Combustor', 'level': 3, 'score': 0.0}, {'id': 'https://openalex.org/C178790620', 'wikidata': 'https://www.wikidata.org/wiki/Q11351', 'display_name': 'Organic chemistry', 'level': 1, 'score': 0.0}]",en,"Hydrogen fueled scramjet is an interesting choice to be used as engine of aerospace vehicles because of its high specific impulse. The most important challenge in scramjet engine technology is the thermal management of them. Due to high temperature of combustion, a competent cooling system which is able to recover the waste energy is needed. The multi-stage open cooling cycle was proposed as appropriate choice by many recent studies. In the present study, the optimization of a novel multi-stage cooling system for hydrogen fueled scramjets is conducted in which the waste heat of scramjet is recovered to produce power and electricity. The optimization process has been done through a thermodynamic zero dimensional analysis. The waste heat of scramjet is used as main heat source of the system. The present study results declare that the energy and exergy efficiencies of the system is improved by 49.24% and 45.98% by optimizing the M-OCC, respectively. In both performance criterion of the system a huge sensible improvement is observed by accomplished optimization."
